Cites,Authors,Title,Year,Source,Publisher,ArticleURL,CitesURL,GSRank,QueryDate,Type,DOI,ISSN,CitationURL,Volume,Issue,StartPage,EndPage,ECC,CitesPerYear,CitesPerAuthor,AuthorCount,Age,Abstract,FullTextURL,RelatedURL
1,"LRC Assunção, PAS Mendes, S Matos, S Borschiver","Technology roadmap of renewable natural gas: Identifying trends for research and development to improve biogas upgrading technology management",2021,"Applied Energy","Elsevier","https://www.sciencedirect.com/science/article/pii/S0306261921003433","https://scholar.google.com/scholar?cites=1583420701688654428&as_sdt=2005&sciodt=2007&hl=en",1,"2021-09-04 12:08:10","","","","",,,,,1,1.00,0,4,1,"… Keywords. Technology Roadmapping. Roadmap. Biogas upgrading. Biomethane. Renewable natural gas. Technology management … Therefore, this TRM provides a new analysis of technology innovation tendencies and knowledge gaps that can be applied to identify partnership …","","https://scholar.google.com/scholar?q=related:XOomJr1w-RUJ:scholar.google.com/&scioq=intitle:%22technology+management%22+technology+innovation&hl=en&as_sdt=2007&as_ylo=2021&as_yhi=2021"
0,"D Cetindamar, R Phaal","Technology Management in the Age of Digital Technologies",2021,"IEEE Transactions on Engineering …","ieeexplore.ieee.org","https://ieeexplore.ieee.org/abstract/document/9518371/","",2,"2021-09-04 12:08:10","","","","",,,,,0,0.00,0,2,1,"… 12]. That is why the same digital artifact, digital platform, or digital infrastructure can lead to different innovations depending on the user or its context … 2003. She is specialized in Innovation and Technology Management. Robert …","https://opus.cloud.lib.uts.edu.au/bitstream/10453/149952/2/Binder1.pdf",""
0,"MC Nejad, S Mansour, A Karamipour","An AHP-based multi-criteria model for assessment of the social sustainability of technology management process: A case study in banking industry",2021,"Technology in Society","Elsevier","https://www.sciencedirect.com/science/article/pii/S0160791X21000774","",3,"2021-09-04 12:08:10","","","","",,,,,0,0.00,0,3,1,"… capabilities and market requirements [20], organizational performance [21], and organization innovation [19] … attempted to sort the factors affecting the prosperity of innovations on forest … AHP is a practical and frequently used method in the technology management domain and …","","https://scholar.google.com/scholar?q=related:X13fpIBI9RUJ:scholar.google.com/&scioq=intitle:%22technology+management%22+technology+innovation&hl=en&as_sdt=2007&as_ylo=2021&as_yhi=2021"
0,"W Asghar, R Rasheed…","Incorporation of Vision, Knowledge and Creativity in Innovation and Technology Management: Synthesizing a Sequential Model",2021,"Journal of Business …","publishing.globalcsrc.org","http://www.publishing.globalcsrc.org/ojs/index.php/jbsee/article/view/1654","",4,"2021-09-04 12:08:10","","","","",,,,,0,0.00,0,3,1,"Purpose: The primary objective of the paper is to synthesise the available literature on technology and innovation management in business firms. The study examines and elaborates the sequential relationship between all constructs that ensure innovation and …","https://www.publishing.globalcsrc.org/ojs/index.php/jbsee/article/download/1654/1119","https://scholar.google.com/scholar?q=related:yKRezpTkkbgJ:scholar.google.com/&scioq=intitle:%22technology+management%22+technology+innovation&hl=en&as_sdt=2007&as_ylo=2021&as_yhi=2021"
0,"GA Olcay","International Journal of Innovation and Technology Management—Special Issue in Honor of Professor M. Atilla Öner (1955–2018) Managing Emergent Technologies",2021,"","World Scientific","https://www.worldscientific.com/doi/abs/10.1142/S0219877021020016","",5,"2021-09-04 12:08:10","","10.1142/S0219877021020016","","",,,,,0,0.00,0,1,1,"This special issue is dedicated to the memory of Professor M. Atilla Öner, who passed away in the most fruitful times of his scholarly life on the 29th of August 2018. Prof. Öner graduated in the first place of the Engineering Faculty at Boğaziçi University in İstanbul, Turkey in 1978 …","https://iibf.yeditepe.edu.tr/sites/default/files/1st_proof_corrections_done_2102001_1.pdf","https://scholar.google.com/scholar?q=related:-vgeSNp-6ewJ:scholar.google.com/&scioq=intitle:%22technology+management%22+technology+innovation&hl=en&as_sdt=2007&as_ylo=2021&as_yhi=2021"
0,"SB Tsai, W Liu, CH Wu","Exploring the role of internationalisation in technology management and green innovation",2021,"Int. J. Technology Management","inderscience.com","https://www.inderscience.com/info/dl.php?filename=2021/ijtm-7242.pdf","",6,"2021-09-04 12:08:10","","","","",,,,,0,0.00,0,3,1,"Over the past several decades, we have witnessed the rapid development of emerging economies such as the 'BRICS', including Brazil, Russia, India, China and South Africa. These countries actively promote the internationalisation process, and have become the …","","https://scholar.google.com/scholar?q=related:-ehAiMyvqzsJ:scholar.google.com/&scioq=intitle:%22technology+management%22+technology+innovation&hl=en&as_sdt=2007&as_ylo=2021&as_yhi=2021"
0,"T Zhou, Y Ma","Business Management System and Information Analysis Platform Based on Science and Technology Innovation Ecology",2021,"Journal of Physics: Conference Series","iopscience.iop.org","https://iopscience.iop.org/article/10.1088/1742-6596/1915/2/022046/meta","",7,"2021-09-04 12:08:10","","","","",,,,,0,0.00,0,2,1,"… [8] Cao Haiwang, Xue Chaogai, Yuan Tianyu. Analysis of the learning process based on AnyLogic enterprise information system innovation [J]. Science and Technology Management Research, 2019, 039(013): 194-204. [9] Wang Li, Wang Ani …","https://iopscience.iop.org/article/10.1088/1742-6596/1915/2/022046/pdf","https://scholar.google.com/scholar?q=related:pdsgdHcQfiAJ:scholar.google.com/&scioq=intitle:%22technology+management%22+technology+innovation&hl=en&as_sdt=2007&as_ylo=2021&as_yhi=2021"
0,"MN Sharif","Industrial technology innovation management for sustained prosperity: True stories revealing the complexity of replicating South Korean success",2021,"Technological Forecasting and Social Change","Elsevier","https://www.sciencedirect.com/science/article/pii/S0040162521001670","",8,"2021-09-04 12:08:10","","","","",,,,,0,0.00,0,1,1,"… his seminal 'Professorial Lecture' on ""The Evolution of Technology Management Studies: Techno … on fact finding missions) to learn about their ""technology for development … he conducted numerous national seminars/workshops on ""technological innovation management"" related …","","https://scholar.google.com/scholar?q=related:5pfur3O3xdkJ:scholar.google.com/&scioq=intitle:%22technology+management%22+technology+innovation&hl=en&as_sdt=2007&as_ylo=2021&as_yhi=2021"
0,"S Amouzad Khalili, K Amouzad Mahdiraji","Evaluating the Relationship between Technology Management and Technology with Organizational Innovation",2021,"Journal of Engineering in …","jeires.com","http://www.jeires.com/article_131089.html","",9,"2021-09-04 12:08:10","HTML","","","",,,,,0,0.00,0,2,1,"The purpose of this paper is to investigate the relationship between technology management and technology with organizational innovation. Case study: Melli Bank branches in Behshahr. The research method is applied according to the purpose and …","http://www.jeires.com/article_131089.html","https://scholar.google.com/scholar?q=related:ENLBzUoS2zwJ:scholar.google.com/&scioq=intitle:%22technology+management%22+technology+innovation&hl=en&as_sdt=2007&as_ylo=2021&as_yhi=2021"
0,"C Pitt, A Park, IP McCarthy","A bibliographic analysis of 20 years of research on innovation and new product development in technology and innovation management (TIM) journals",2021,"… of Engineering and Technology Management","Elsevier","https://www.sciencedirect.com/science/article/pii/S0923474821000217","",10,"2021-09-04 12:08:10","","","","",,,,,0,0.00,0,3,1,"In this perspectives article, we analyze 20 years of research on the topics of “innovation management” and “new product development” in the technology and innovation management (TIM) domain. More specifically, we investigate the questions related to three …","","https://scholar.google.com/scholar?q=related:40ayl1cN5_QJ:scholar.google.com/&scioq=intitle:%22technology+management%22+technology+innovation&hl=en&as_sdt=2007&as_ylo=2021&as_yhi=2021"
0,"J Du, F Weng","Construction management and technology innovation for main projects of Quanzhou Bay Bridge",2021,"Frontiers of Engineering Management","journal.hep.com.cn","https://journal.hep.com.cn/fem/EN/article/downloadArticleFile.do?attachType=PDF&id=28665","",11,"2021-09-04 12:08:10","PDF","","","",,,,,0,0.00,0,2,1,"… requirements, high intellectualization and informatization requirements, high environmental protection requirements, large project scale, and multiple difficulties in terms of technology, management, and coordination between … 2 Engineering construction technology innovation …","https://journal.hep.com.cn/fem/EN/article/downloadArticleFile.do?attachType=PDF&id=28665",""
0,"A Shaygan","Technology Management Maturity Assessment Model in Healthcare",2021,"","search.proquest.com","https://search.proquest.com/openview/afa7b55059a2692d5de01a5323646e31/1?pq-origsite=gscholar&cbl=18750&diss=y","",12,"2021-09-04 12:08:10","","","","",,,,,0,0.00,0,1,1,"… Doctor of Philosophy in Technology Management … rise of disruptive innovations, the adoption of electronic health records and novel … Continuous learning is especially important in the research centers that act as innovation hubs within University Hospitals …","https://pdxscholar.library.pdx.edu/cgi/viewcontent.cgi?article=6769&context=open_access_etds",""
0,"JC Rodríguez, M Gómez, MA Manzo","High-performance level and technology management among winery firms in the wine industry cluster of baja california: a fsQCA approach",2021,"Revista de Administração de …","SciELO Brasil","https://www.scielo.br/j/rae/a/8Xdyff5HCRkGsQvh5qfCWKm/abstract/?lang=en","",13,"2021-09-04 12:08:10","","","","",,,,,0,0.00,0,3,1,"… in Baja California do not need to develop interdependent innovations to achieve a … KEYWORDS: High performance level; technology management; wine industry; fuzzy-set qualitative comparative … & A. Kuckertz (Eds.), Complexity in entrepreneurship, innovation and technology …","https://www.scielo.br/j/rae/a/8Xdyff5HCRkGsQvh5qfCWKm/?lang=en","https://scholar.google.com/scholar?q=related:vVmJrvh5i_IJ:scholar.google.com/&scioq=intitle:%22technology+management%22+technology+innovation&hl=en&as_sdt=2007&as_ylo=2021&as_yhi=2021"
0,"G Schuh, HJ Boßmeyer…","Data-Driven Technology Management Supported by Artificial Intelligence Solutions",2021,"Journal of Production …","repo.uni-hannover.de","https://www.repo.uni-hannover.de/handle/123456789/10605","",14,"2021-09-04 12:08:10","","","","",,,,,0,0.00,0,3,1,"… Employees record worldwide news on relevant technologies and innovations, which are then edited and posted on the platform … Finally, there are offerings that focus very specifically on supporting innovation or technology management processes …","https://www.repo.uni-hannover.de/bitstream/handle/123456789/10605/Schuh%202021%20-%20Data-Driven%20Technology%20Management.pdf?sequence=4&isAllowed=y","https://scholar.google.com/scholar?q=related:g8PDVFgA7CEJ:scholar.google.com/&scioq=intitle:%22technology+management%22+technology+innovation&hl=en&as_sdt=2007&as_ylo=2021&as_yhi=2021"
0,"J Feng","Research on Generic Technology Management of Integrated Circuit Industry",2021,"2021 2nd Asia-Pacific Conference on Image …","dl.acm.org","https://dl.acm.org/doi/abs/10.1145/3452446.3452570","",15,"2021-09-04 12:08:10","","10.1145/3452446.3452570","","",,,,,0,0.00,0,1,1,"… 9] believes that IC technology is pro- moted by application requirements and developed through a series of innovations, including original … of the information age, the IC industry needs to be highly valued in the reform and innovation of generic technology management in the …","","https://scholar.google.com/scholar?q=related:aOzaV6I_yUUJ:scholar.google.com/&scioq=intitle:%22technology+management%22+technology+innovation&hl=en&as_sdt=2007&as_ylo=2021&as_yhi=2021"
0,"A Lucena, V Diaz Moriana…","The role of technology management and connectedness in the product innovation of family firms",2021,"Academy of …","journals.aom.org","https://journals.aom.org/doi/abs/10.5465/AMBPP.2021.15134abstract","",16,"2021-09-04 12:08:10","","10.5465/AMBPP.2021.15134abstract","","",,,,,0,0.00,0,3,1,"There has been much debate concerning product innovation in family firms given its importance for their continuity across generations. However, most prior research has focused on comparing family and non-family firms neglecting the reasons behind why family …","",""
0,"Z Li, X Ren, Y Shen, X Zhang…","Management and Practice of International Science and Technology Innovation Cooperation Driven by Big Data",2021,"2021 IEEE 3rd …","ieeexplore.ieee.org","https://ieeexplore.ieee.org/abstract/document/9477741/","",17,"2021-09-04 12:08:10","","","","",,,,,0,0.00,0,5,1,"… and Technology Innovation Cooperation Driven by … become one of the important tasks to build and improve the data management information system of ISTC at national level, which plays an indispensable role in optimizing China's science and technology management as well …","",""
0,"T Bergström","… OF TECHNOLOGY MANAGEMENT AND ECONOMICS DIVISION OF SERVICE MANAGEMENT AND LOGISTICS CHALMERS UNIVERSITY OF TECHNOLOGY …",2021,"","odr.chalmers.se","https://odr.chalmers.se/handle/20.500.12380/302479","",18,"2021-09-04 12:08:10","","","","",,,,,0,0.00,0,1,1,"The use of Early Contractor Involvement (ECI) has gained increased attention in the construction industry as a means to remove the separation of projects' design and construction, thus integrating the contractor's expertise and knowledge in early planning and …","https://odr.chalmers.se/bitstream/20.500.12380/302479/1/E2021_070.pdf","https://scholar.google.com/scholar?q=related:li55UlF35P4J:scholar.google.com/&scioq=intitle:%22technology+management%22+technology+innovation&hl=en&as_sdt=2007&as_ylo=2021&as_yhi=2021"
0,"CSL Kuei-ChienChiua, HH Chuc…","The Effect of Learning Factory Approach on Technology Management Education for Social Science Students",2021,"Turkish Journal of …","turcomat.org","https://turcomat.org/index.php/turkbilmat/article/view/2001","",19,"2021-09-04 12:08:10","","","","",,,,,0,0.00,0,3,1,"… M. Tas, and HO Yeloglu, ""The Need for Technology Management Education for Undergraduate Programs: A Conceptual Framework,"" Universal Journal of Educational Research, vol. 6, no … ""IAMOT and education: defining a technology and innovation management (TIM …","https://turcomat.org/index.php/turkbilmat/article/download/2001/1732","https://scholar.google.com/scholar?q=related:I_RCfmEk1OYJ:scholar.google.com/&scioq=intitle:%22technology+management%22+technology+innovation&hl=en&as_sdt=2007&as_ylo=2021&as_yhi=2021"
0,"FC Paletta, AM da Silva","Information technology management: it governance in digital library",2021,"Brazilian Journal of Development","brazilianjournals.com","https://www.brazilianjournals.com/index.php/BRJD/article/view/24026","",20,"2021-09-04 12:08:10","","","","",,,,,0,0.00,0,2,1,"… Keywords: Information Technology, Information Technology Management, IT Governance, Information Systems, Digital Library … responsibility for Information Technology personnel Technological innovation and the ubiquity of communication tools, economic …","https://www.brazilianjournals.com/index.php/BRJD/article/download/24026/19275","https://scholar.google.com/scholar?q=related:aCVS-o7AhR8J:scholar.google.com/&scioq=intitle:%22technology+management%22+technology+innovation&hl=en&as_sdt=2007&as_ylo=2021&as_yhi=2021"
0,"X Luo, R Huang","Application of Adaptive Co-evolutionary Algorithms to Technology Innovation Management",2021,"Wireless Personal Communications","Springer","https://link.springer.com/article/10.1007/s11277-021-08356-9","",21,"2021-09-04 12:08:10","","10.1007/s11277-021-08356-9","","",,,,,0,0.00,0,2,1,"… technology in the national science and technology management platform, let the algorithm to complete data analysis, plan the data flow, improve the decision-making ability of functional departments, to achieve the upgrade of science, technology, and innovation management …","","https://scholar.google.com/scholar?q=related:-j5JmD9esakJ:scholar.google.com/&scioq=intitle:%22technology+management%22+technology+innovation&hl=en&as_sdt=2007&as_ylo=2021&as_yhi=2021"
0,"D Ktoridou, E Epaminonda…","Special Issue"" Technology and Innovation Management in Education""",2021,"Sustainability (Switzerland)","pure.unic.ac.cy","https://pure.unic.ac.cy/en/publications/special-issue-technology-and-innovation-management-in-education","",22,"2021-09-04 12:08:10","","","","",,,,,0,0.00,0,3,1,"… and sustaining innovations in education and business sustainability;Cultivating creative thinking skills reflecting how learners approach sustainabilityDivergent and convergent process for creative sustainability;Challenges of innovation and technology management in …","",""
0,"D Wang, Q Li, C Xu, P Wang…","Research of Data Warehouse for Science and Technology Management System",2021,"… Conference on Service …","ieeexplore.ieee.org","https://ieeexplore.ieee.org/abstract/document/9492198/","",23,"2021-09-04 12:08:10","","","","",,,,,0,0.00,0,5,1,"… Science and technology management innovation improves the scientific and technological level of a country, and usually needs to be supported by science and technology management systems [1]. Therefore, the systems have been popular in most universities, institutions …","",""
0,"JC Liu, M Yeats","An Academic Ethics Issue in the Journal of Technology Management",2021,"Journal of Sciences & Humanities 科學與人文 …","researchgate.net","https://www.researchgate.net/profile/Jen-Chang-Liu-2/publication/350819259_An_Academic_Ethics_Issue_in_the_Journal_of_Technology_Management_kejiguanlixuekanxueshulunlizhengyishijian/links/607cef318ea909241e0c7251/An-Academic-Ethics-Issue-in-the-Journal-of-Technology-Management-kejiguanlixuekanxueshulunlizhengyishijian.pdf","",24,"2021-09-04 12:08:10","PDF","","","",,,,,0,0.00,0,2,1,"… [1] 李宗耀、蔡志宏、陳炫碩、鄭嘉隆（2016）。製造業高值化之設計創新與分析。科技管 理學刊，21(4)，65 -96。Lee, ZY, Tsai, CH, Chen, SS, & Cheng, CL (2016). Analysis and design innovation of in the high-valued manufacturing. Journal of Technology Management, 21(4), 65 …","https://www.researchgate.net/profile/Jen-Chang-Liu-2/publication/350819259_An_Academic_Ethics_Issue_in_the_Journal_of_Technology_Management_kejiguanlixuekanxueshulunlizhengyishijian/links/607cef318ea909241e0c7251/An-Academic-Ethics-Issue-in-the-Journal-of-Technology-Management-kejiguanlixuekanxueshulunlizhengyishijian.pdf","https://scholar.google.com/scholar?q=related:71v9a1lr4nIJ:scholar.google.com/&scioq=intitle:%22technology+management%22+technology+innovation&hl=en&as_sdt=2007&as_ylo=2021&as_yhi=2021"
0,"F Katimertzopoulos","Innovation in Stra. Tech. Man (Strategy-Technology-Management) Terms",,"academia.edu","","https://www.academia.edu/download/66600107/11326.pdf","",25,"2021-09-04 12:08:10","PDF","","","",,,,,0,0.00,0,1,,"The conventional neoclassic approach of the entrepreneurial economic development perceives innovation to a large extent restrictively and unproductively. In a parallel motion, the conventional Keynesian perspective proves to be as well insufficient to study the …","https://www.academia.edu/download/66600107/11326.pdf","https://scholar.google.com/scholar?q=related:ChqeLw1EfS4J:scholar.google.com/&scioq=intitle:%22technology+management%22+technology+innovation&hl=en&as_sdt=2007&as_ylo=2021&as_yhi=2021"
0,"S Satyanarayana, V Narra","INTER-SURFACE ORGANIZATIONAL PROBLEMS AND TECHNOLOGY MANAGEMENT",,"aeijmr.com","","https://aeijmr.com/wp-content/uploads/2021/06/Inter-Surface-Organizational-Problems-and-Technology-Management.pdf","",26,"2021-09-04 12:08:10","PDF","","","",,,,,0,0.00,0,2,,"… It is important to highlight basic aspects related to value creation and business model, strategy formation and execution, technology strategy, technology management, innovation management, and interface between technology and innovation strategy, Z. Mahmood, A. Amir, et …","https://aeijmr.com/wp-content/uploads/2021/06/Inter-Surface-Organizational-Problems-and-Technology-Management.pdf",""
0,"SF Ferdous, MA Badar, JN McKirahan…","Comparing Ph. D. in Engineering Management and Technology Management Programs",,"ieomsociety.org","","http://www.ieomsociety.org/singapore2021/papers/90.pdf","",27,"2021-09-04 12:08:10","PDF","","","",,,,,0,0.00,0,4,,"… The first three were included in McKirahan et al. (2020), whereas UCSB's Ph.D. in Technology Management is new. Northcentral University (NCU, 2020) is another university that offers a Ph.D. in Technology and Innovation Management …","http://www.ieomsociety.org/singapore2021/papers/90.pdf","https://scholar.google.com/scholar?q=related:SfJaMKM7dZEJ:scholar.google.com/&scioq=intitle:%22technology+management%22+technology+innovation&hl=en&as_sdt=2007&as_ylo=2021&as_yhi=2021"
0,"S Sahay, A Bharti","Green Communication Technology Management for Sustainability in Organization",2021,"Smart and Sustainable Intelligent Systems","Wiley Online Library","https://onlinelibrary.wiley.com/doi/abs/10.1002/9781119752134.ch26","",28,"2021-09-04 12:08:10","","10.1002/9781119752134.ch26","","",,,,,0,0.00,0,2,1,"… Page 6. Green Communication Technology Management 379 … 4. Motivating Workforce Morale and Innovations Identifying and implementing green and sustainable initiatives by employees is a … Working towards achieving sustainability will bring innovation in the organization …","","https://scholar.google.com/scholar?q=related:tP6WqVSaMT4J:scholar.google.com/&scioq=intitle:%22technology+management%22+technology+innovation&hl=en&as_sdt=2007&as_ylo=2021&as_yhi=2021"
0,"B Hu, SM Noman, M Irshad, X Tang, C Song…","Run-Time Prediction Practices of Multimedia Web Design in Technology Management",2021,"… Signal Processing and …","Springer","https://link.springer.com/chapter/10.1007/978-981-16-3180-1_23","",29,"2021-09-04 12:08:10","","10.1007/978-981-16-3180-1_23","","",,,,,0,0.00,0,6,1,"… First Online: 30 August 2021. Part of the Smart Innovation, Systems and … of organizations will become part of multimedia design in technology management by adopting new … multimedia production competencies and skills of instructional design and technology professionals: an …","",""
0,"E Mnif, K Mouakhar, A Jarboui","Journal of High Technology Management Research",,"researchgate.net","","https://www.researchgate.net/profile/Anis-Jarboui/publication/352542764_Blockchain_technology_awareness_on_social_media_Insights_from_twitter_analytics/links/60fb31741e95fe241a83f3e7/Blockchain-technology-awareness-on-social-media-Insights-from-twitter-analytics.pdf","",30,"2021-09-04 12:08:10","PDF","","","",,,,,0,0.00,0,3,,"… Besides, the perceived usefulness looks for the need for this technology's usefulness compared to other innovations … Blockchain application and outlook in the banking industry. Financial Innovation … Journal of High Technology Management Research xxx (xxxx) 100416 …","https://www.researchgate.net/profile/Anis-Jarboui/publication/352542764_Blockchain_technology_awareness_on_social_media_Insights_from_twitter_analytics/links/60fb31741e95fe241a83f3e7/Blockchain-technology-awareness-on-social-media-Insights-from-twitter-analytics.pdf",""
0,"D Wang, Z Zhang, C Xu, Z Wang","Data Query Method of Science and Technology Management Based on Relational Engine",2021,"2021 IEEE 6th International …","ieeexplore.ieee.org","https://ieeexplore.ieee.org/abstract/document/9442601/","",31,"2021-09-04 12:08:10","","","","",,,,,0,0.00,0,4,1,"… Fully mining the potential value of data can help the government implement the reform of science and technology management, grasp the trend of science and technology, and respond to the technological innovation market to produce new decisions …","","https://scholar.google.com/scholar?q=related:2Fi3cWuw2JwJ:scholar.google.com/&scioq=intitle:%22technology+management%22+technology+innovation&hl=en&as_sdt=2007&as_ylo=2021&as_yhi=2021"
0,"RA de Lima, IA da Rocha","HEALTH TECHNOLOGY MANAGEMENT: EVALUATION OF ELECTROMEDICAL EQUIPMENT IN AN OPERATING ROOM UNIT.",,"seer.unirio.br","","http://seer.unirio.br/rectis/article/download/10913/pdf_1/53222","",32,"2021-09-04 12:08:10","PDF","","","",,,,,0,0.00,0,2,,"… 11 Artigos HEALTH TECHNOLOGY MANAGEMENT: EVALUATION OF ELECTROMEDICAL EQUIPMENT IN AN OPERATING ROOM UNIT … DESCRIPTORS: Management science; Technology and innovation in health; Nursing; Evaluation of biomedical technology …","http://seer.unirio.br/rectis/article/download/10913/pdf_1/53222","https://scholar.google.com/scholar?q=related:XLZ289YGSiUJ:scholar.google.com/&scioq=intitle:%22technology+management%22+technology+innovation&hl=en&as_sdt=2007&as_ylo=2021&as_yhi=2021"
0,"H Tangut","Technology Management in Terrorism",2021,"… of Industrial Policy and Technology Management","jipat.org","http://jipat.org/index.php/jipat/article/view/56","",33,"2021-09-04 12:08:10","","","","",,,,,0,0.00,0,1,1,"… Technology Management in Terrorism. Hakan Tangut. Abstract … New alternatives for counterterrorism are emerging with the developing technology. The purpose of the study is to examine technology management in the fight against terrorism …","",""
