Cites,Authors,Title,Year,Source,Publisher,ArticleURL,CitesURL,GSRank,QueryDate,Type,DOI,ISSN,CitationURL,Volume,Issue,StartPage,EndPage,ECC,CitesPerYear,CitesPerAuthor,AuthorCount,Age,Abstract,FullTextURL,RelatedURL
0,"JK Mohammed, MZ Bello","Potentials of information and communication technology in real estate management and valuation practice",2021,"","researchgate.net","https://www.researchgate.net/profile/Jibrin-Mohammed/publication/349637387_Potentials_of_information_and_communication_technology_in_real_estate_management_and_valuation_practice/links/603922e992851c4ed59d5948/Potentials-of-information-and-communication-technology-in-real-estate-management-and-valuation-practice.pdf","",97,"2021-09-04 12:08:10","PDF","","","",,,,,0,0.00,0,2,1,"… The Internet of Things: Limitless Opportunities for Business and Society. Journal of Strategic Innovation and Sustainability, 12(1), 10–29 … ICT Innovations 2012 Web Proceedings, 537–538. 21 … Journal of Information Systems and Technology Management, 16, 1–17 …","https://www.researchgate.net/profile/Jibrin-Mohammed/publication/349637387_Potentials_of_information_and_communication_technology_in_real_estate_management_and_valuation_practice/links/603922e992851c4ed59d5948/Potentials-of-information-and-communication-technology-in-real-estate-management-and-valuation-practice.pdf","https://scholar.google.com/scholar?q=related:FR9FKhwutJ0J:scholar.google.com/&scioq=intitle:%22technology+management%22+technology+innovation&hl=en&as_sdt=2007&as_ylo=2021&as_yhi=2021"
0,"OL Ostos, R Rentería-Ramos, F Cala","Construction of a Complex Network Using Technological Surveillance for the Strategic Management of Science, Technology, And Research in Higher …",2021,"Turkish Journal of Computer …","turcomat.org","https://www.turcomat.org/index.php/turkbilmat/article/download/10407/7854","",98,"2021-09-04 12:08:10","PDF","","","",,,,,0,0.00,0,3,1,"… scientific research towards solving the issues identified by the most important stakeholders of the National System of Science, Technology, and Innovation of Colombia … According to Leon (2006): “Technological surveillance (TS) is a concept inherent to technology management …","https://www.turcomat.org/index.php/turkbilmat/article/download/10407/7854",""
0,"C Czarnecki, P Fettke","Robotic Process Automation: Management, Technology, Applications",2021,"","books.google.com","https://books.google.com/books?hl=en&lr=&id=HFw8EAAAQBAJ&oi=fnd&pg=PT9&dq=%22technology+management%22+technology+innovation&ots=ke9FnTJMHY&sig=ut4QHoq2NlzTzvG5fZQjQSXJXV4","",99,"2021-09-04 12:08:10","BOOK","","","",,,,,0,0.00,0,2,1,"… on the implementation of Robotic Process Automation in accounting and finance tasks and her teaching innovation centers around … Process Automation and Process Management with focus on the telecommunication industry at the technology management consultancy Detecon …","",""
0,"Y Li, X Huang, M Lin, M Gao, H Yue…","Design of power decommissioning material management system based on RFID technology",2021,"Journal of Physics …","iopscience.iop.org","https://iopscience.iop.org/article/10.1088/1742-6596/2006/1/012027/meta","",100,"2021-09-04 12:08:10","","","","",,,,,0,0.00,0,6,1,"… Management system of power decommissioning materials based on two-dimensional code recognition technology … 2019) Application of power cable intelligent patrol system based on RFID technology in distribution … 8] Zhang, ZG, Zeng, M., Cai, JF (2019) Innovation and Practice …","https://iopscience.iop.org/article/10.1088/1742-6596/2006/1/012027/pdf",""
2,"A Spanellis, J MacBryde, V Dӧrfler","A dynamic model of knowledge management in innovative technology companies: A case from the energy sector",2021,"European Journal of Operational …","Elsevier","https://www.sciencedirect.com/science/article/pii/S0377221720309498","https://scholar.google.com/scholar?cites=15573289906584334239&as_sdt=2005&sciodt=2007&hl=en",101,"2021-09-04 12:08:10","","","","",,,,,2,2.00,1,3,1,"… Fig. 2. Knowledge in practice types for organisational work. Source: (McIver et al., 2013). The two KM decision aid frameworks complement each other and are aligned with the characteristics that one can expect to find in an innovation team of a technology company …","","https://scholar.google.com/scholar?q=related:n68iwqhwH9gJ:scholar.google.com/&scioq=intitle:%22technology+management%22+technology+innovation&hl=en&as_sdt=2007&as_ylo=2021&as_yhi=2021"
0,"L Zhao, J Deng, Y Ma, Y Zhu","Design of digital business center of enterprise project management system based on Information Technology",2021,"Journal of Physics: Conference …","iopscience.iop.org","https://iopscience.iop.org/article/10.1088/1742-6596/1744/2/022010/meta","",102,"2021-09-04 12:08:10","","","","",,,,,0,0.00,0,4,1,"… 022010 5 technology management Data … et al. Use and Efficacy of Information Technology in Innovation Processes: The Specific Role of Servitization[J]. Journal of Product Innovation Management, 2018, 35(5):720-741. [4] Wang …","https://iopscience.iop.org/article/10.1088/1742-6596/1744/2/022010/pdf","https://scholar.google.com/scholar?q=related:mRBXR_GDPUMJ:scholar.google.com/&scioq=intitle:%22technology+management%22+technology+innovation&hl=en&as_sdt=2007&as_ylo=2021&as_yhi=2021"
0,"J He, H Li","On the influence of information technology on the development of public management",2021,"Journal of Physics: Conference Series","iopscience.iop.org","https://iopscience.iop.org/article/10.1088/1742-6596/1802/4/042054/meta","",103,"2021-09-04 12:08:10","","","","",,,,,0,0.00,0,2,1,"… of information technology has effectively improved the level of information technology management, but also … of public management, so that the management mode will have fundamental innovation and change. 3. The influence of information technology on public management …","https://iopscience.iop.org/article/10.1088/1742-6596/1802/4/042054/pdf",""
0,"ER Faulds, M Grey, H Tubbs‐Cooley…","Expect the unexpected: Adolescent and pre‐teens' experience of diabetes technology self‐management",2021,"Pediatric …","Wiley Online Library","https://onlinelibrary.wiley.com/doi/abs/10.1111/pedi.13249","",104,"2021-09-04 12:08:10","","10.1111/pedi.13249","","",,,,,0,0.00,0,4,1,"… Columbus, OH Page 3. Mary Beth Happ, PhD, RN, FAAN Professor and Associate Dean of Research and Innovation The Ohio State University College of Nursing Columbus, OH … Page 14. Unplanned technology management. Technology interactions like sensor changes or …","",""
0,"J Guo, D Wang","An empirical study on artificial intelligence technology based on big data to assist enterprise management decision",2021,"The International Journal of Electrical …","journals.sagepub.com","https://journals.sagepub.com/doi/abs/10.1177/0020720920983547","",105,"2021-09-04 12:08:10","","10.1177/0020720920983547","","",,,,,0,0.00,0,2,1,"… It integrates computer technology, management science and organization theory … information communication, improve the big data analysis system, and promote the deep integration application, so as to improve the strength of big data technology innovation achievements in …","","https://scholar.google.com/scholar?q=related:nmX8i0Fg2P8J:scholar.google.com/&scioq=intitle:%22technology+management%22+technology+innovation&hl=en&as_sdt=2007&as_ylo=2021&as_yhi=2021"
0,"SCM Barbalho, J Carlos de Toledo…","Transitions in Project Management Offices: A Framework Relating Functions, Success Factors and Project Performance in a High-Technology Company",2021,"Engineering …","Taylor & Francis","https://www.tandfonline.com/doi/abs/10.1080/10429247.2021.1925497","",106,"2021-09-04 12:08:10","","10.1080/10429247.2021.1925497","","",,,,,0,0.00,0,3,1,"… Functions of project management offices and the satisfaction of project personnel in new product development. International Journal of Business Innovation and Research, Approved in Process for Publication … Journal of Engineering and Technology Management, 42, 65–80 …","","https://scholar.google.com/scholar?q=related:wG162Ut7wjIJ:scholar.google.com/&scioq=intitle:%22technology+management%22+technology+innovation&hl=en&as_sdt=2007&as_ylo=2021&as_yhi=2021"
0,"G Busolo","Application of a Multilevel Technology Acceptance Management Model for Effective Technology Deployment",2021,"… Journal of Computer Science & Information Technology …","papers.ssrn.com","https://papers.ssrn.com/sol3/papers.cfm?abstract_id=3816397","",107,"2021-09-04 12:08:10","","","","",,,,,0,0.00,0,1,1,"… of PC utilization by Thompson, Higgins & Howell (1991), the innovation diffusion theory … Applying Theory of Diffussion of Innovations to Evaluate Technology Acceptance and … the Novelty Technology, Electronic Journal of Information Systems and Technology Management, 14(1 …","https://www.researchgate.net/profile/Jose-Joy-2/publication/350514540_Application_of_a_Multilevel_Technology_Acceptance_Management_Model_for_Effective_Technology_Deployment/links/60642d3b92851cd8ce7b20de/Application-of-a-Multilevel-Technology-Acceptance-Management-Model-for-Effective-Technology-Deployment.pdf","https://scholar.google.com/scholar?q=related:wbr5fDeQ8wwJ:scholar.google.com/&scioq=intitle:%22technology+management%22+technology+innovation&hl=en&as_sdt=2007&as_ylo=2021&as_yhi=2021"
0,"J Razmak, CH Bélanger…","Electronic medical records: taking young generations of patients and physicians through innovative technology and change management",2021,"… Journal of Electronic …","inderscienceonline.com","https://www.inderscienceonline.com/doi/abs/10.1504/IJEH.2021.117121","",108,"2021-09-04 12:08:10","","10.1504/IJEH.2021.117121","","",,,,,0,0.00,0,3,1,"… His primary research interests are in the field of business and technology management … generations of patients who are making a push toward the use of more technology in the … the adoption of EMRs and overcoming the challenges that inhibit its use require innovation in many …","",""
1,"A muayad younus Alzahawi…","Evaluating the role of scrum methodology for risk management in information technology enterprises",2021,"… of Information Technology …","sabapub.com","https://sabapub.com/index.php/jitc/article/view/159","https://scholar.google.com/scholar?cites=17615761094527976801&as_sdt=2005&sciodt=2007&hl=en",109,"2021-09-04 12:08:10","","","","",,,,,1,1.00,1,2,1,"… ""Agility and the role of project—Internal control systems for innovation project performance."" International Journal of Innovation Management 24.07 … Impact analysis of agile method based on risk management for developing technology management in (SMEs) Small and Medium …","https://sabapub.com/index.php/jitc/article/download/159/172",""
0,"K Knop","Management of packaging labeling technology in the context of improving the final product quality and work safety",2021,"System Safety: Human-Technical Facility-Environment","sciendo.com","https://sciendo.com/pdf/10.2478/czoto-2021-0013","",110,"2021-09-04 12:08:10","PDF","10.2478/czoto-2021-0013","","",,,,,0,0.00,0,1,1,"… REFERENCES Albert J., 2010. Innovations in food labeling, The Food and Agriculture Organization of the United Nations and Woodhead Publishing Limited, Sawston, Cambridge … Food packaging science and technology. CRC Press, London. Lowe H., 1995 …","https://sciendo.com/pdf/10.2478/czoto-2021-0013",""
0,"AA Austin, LT Williams","Evaluating company adoptions of blockchain technology: How do management and auditor communications affect nonprofessional investor judgments?",2021,"Journal of Accounting and Public Policy","Elsevier","https://www.sciencedirect.com/science/article/pii/S027842542100065X","",111,"2021-09-04 12:08:10","","","","",,,,,0,0.00,0,2,1,"… Over the last several decades, technological innovation has transformed traditional business … individuals “fear the unfamiliar.” For example, diffusion of innovations theory finds … does not reference a company's adoption of advanced technology, management communications that …","",""
0,"เหรียญ ประดับ, สุภา ภร ณ์","ผล การ จัดการ สมรรถนะ การ เรียน รู้ ของ ผู้ เรียน ด้าน วิทยาศาสตร์ และ เทคโนโลยี ระดับ ปริญญา ตรี Results of Learning Performance Management of Science and Technology …",2021,"วารสาร สังคมศาสตร์ มหาวิทยาลัย …","ejournals.swu.ac.th","http://ejournals.swu.ac.th/index.php/JOS/article/view/12910","",112,"2021-09-04 12:08:10","","","","",,,,,0,0.00,0,2,1,"… to support the migrant market (Office of Science Policy Committee National Technology and Innovation. 2019) … Welding Engineering Technology, Electrical Engineering Technology, Industrial Engineering Technology, and production and Information Technology Management …","http://ejournals.swu.ac.th/index.php/JOS/article/download/12910/10590","https://scholar.google.com/scholar?q=related:41xqFdgQ4T4J:scholar.google.com/&scioq=intitle:%22technology+management%22+technology+innovation&hl=en&as_sdt=2007&as_ylo=2021&as_yhi=2021"
0,"DRV KHARE","Impact of Information Technology (IT) On Management Accounting and Financial Accounting",2021,"Journal of Contemporary Issues in Business and …","cibg.org.au","https://cibg.org.au/index.php/cibg/article/view/article_10932.html","",113,"2021-09-04 12:08:10","","","","",,,,,0,0.00,0,1,1,"… 880 Information Technology It is the technology management area & encompasses a wide range of areas that contain, but they are not in limited, things like … 2. PM Ferrando and RP Dameri, “Accounting information systems,” Information Technology and Innovation Trends in …","https://cibg.org.au/article_10932_afddb4bb15f503ac781d08d53f5af472.pdf","https://scholar.google.com/scholar?q=related:T2p1zn5oEVYJ:scholar.google.com/&scioq=intitle:%22technology+management%22+technology+innovation&hl=en&as_sdt=2007&as_ylo=2021&as_yhi=2021"
0,"H Chen","Research on the Strategies of Cultivating Management Accounting Talents in Universities under the Background of the Development of Information Technology",2021,"… on Information Management and Technology","dl.acm.org","https://dl.acm.org/doi/abs/10.1145/3465631.3465784","",114,"2021-09-04 12:08:10","","10.1145/3465631.3465784","","",,,,,0,0.00,0,1,1,"… KEYWORDS Information Technology, Management Accounting, Talent Training ACM Reference Format … informa- tion technology education, establish an ""information technology + professional"" compound … the same time, the professional-related innovation and entrepreneurship …","",""
0,"M Amukanga, W Otuya","Information Communication Technology on Supply Chain Management Performance-A Critical Literature Review",,"researchgate.net","","https://www.researchgate.net/profile/Michael-Amukanga/publication/348870389_Information_Communication_Technology_on_Supply_Chain_Management_Performance_-A_Critical_Literature_Review/links/6013db03a6fdcc071b9d6c9f/Information-Communication-Technology-on-Supply-Chain-Management-Performance-A-Critical-Literature-Review.pdf","",115,"2021-09-04 12:08:10","PDF","","","",,,,,0,0.00,0,2,,"… of Application on Innovation in Engineering and Management (IJAIEM), 2 (1), 201-210. [23]. Scupola, A. (2010). ICT Adoption in Facilities Management Supply Chain: The Case of Denmark. Vol, 15, No. 1. Denmark. Journal of Global Information Technology Management, Vol 15 …","https://www.researchgate.net/profile/Michael-Amukanga/publication/348870389_Information_Communication_Technology_on_Supply_Chain_Management_Performance_-A_Critical_Literature_Review/links/6013db03a6fdcc071b9d6c9f/Information-Communication-Technology-on-Supply-Chain-Management-Performance-A-Critical-Literature-Review.pdf","https://scholar.google.com/scholar?q=related:orLdqU1uc18J:scholar.google.com/&scioq=intitle:%22technology+management%22+technology+innovation&hl=en&as_sdt=2007&as_ylo=2021&as_yhi=2021"
0,"MC Azad","Information Technology Resources and Knowledge Management in Competitive Advantage with the Mediating Role of Organizational Commitment (Case Study: Tile …",2021,"Turkish Journal of Computer and Mathematics …","turcomat.org","https://www.turcomat.org/index.php/turkbilmat/article/view/9613","",116,"2021-09-04 12:08:10","","","","",,,,,0,0.00,0,1,1,"… knowledge to gain a higher level of efficiency and innovation … the first international conference on management science, developments, innovations and challenges, Shiraz … National Conference on Computer Engineering and Information Technology Management, Tehran, Tolo …","https://www.turcomat.org/index.php/turkbilmat/article/download/9613/7328",""
0,"J Kääriäinen","A framework for agility in technology roadmapping in EA and IT portfolio management",2021,"","jyx.jyu.fi","https://jyx.jyu.fi/handle/123456789/75279","",117,"2021-09-04 12:08:10","","","","",,,,,0,0.00,0,1,1,"… The agile roadmap management consists of three steps: planning the updating cycle, managing the updating cycle and analyzing the strategy of innovation … 5 MONITORING AND UPDATING TECHNOLOGY ROADMAPS IN EA AND IT PORTFOLIO MANAGEMENT Page 35. 35 …","https://jyx.jyu.fi/bitstream/handle/123456789/75279/URN%3ANBN%3Afi%3Ajyu-202105042593.pdf?sequence=1","https://scholar.google.com/scholar?q=related:0vecQqNo1bMJ:scholar.google.com/&scioq=intitle:%22technology+management%22+technology+innovation&hl=en&as_sdt=2007&as_ylo=2021&as_yhi=2021"
0,"P Gyau, E Badu","Examination of project communication management on information technology projects in the banking sector in Ghana.",2021,"","ir.knust.edu.gh","http://ir.knust.edu.gh/handle/123456789/14094","",118,"2021-09-04 12:08:10","","","","",,,,,0,0.00,0,2,1,"… From the research conducted by, Shahet and Fredman (2004), determined that, IT projects in the Israel Information Technology Management Procurement Agreement make use of effective communication model at the manager level …","http://ir.knust.edu.gh/xmlui/bitstream/handle/123456789/14094/Patrick%20Gyau.pdf?sequence=1",""
0,"O Gassmann, MA Bader, MJ Thompson","Patent Management in New Technology Environments",2021,"Patent Management","Springer","https://link.springer.com/chapter/10.1007/978-3-030-59009-3_7","",119,"2021-09-04 12:08:10","","10.1007/978-3-030-59009-3_7","","",,,,,0,0.00,0,3,1,"… to optimize technological parameters, and thus come up with new inventions and innovations that are better … The role of innovation and IP in AI-based business models … International Journal of Technology Management, 73(4), 151–175.CrossRefGoogle Scholar. Chen, F. (2019) …","","https://scholar.google.com/scholar?q=related:ffq2PU5uZpQJ:scholar.google.com/&scioq=intitle:%22technology+management%22+technology+innovation&hl=en&as_sdt=2007&as_ylo=2021&as_yhi=2021"
1,"BCA Petroni, MS Pfitzner","A Framework of Blockchain Technology for Public Management in Brazil",2021,"Blockchain and the Public Sector","Springer","https://link.springer.com/chapter/10.1007/978-3-030-55746-1_7","https://scholar.google.com/scholar?cites=8795290377283100372&as_sdt=2005&sciodt=2007&hl=en",120,"2021-09-04 12:08:10","","10.1007/978-3-030-55746-1_7","","",,,,,1,1.00,1,2,1,"… Increase transparency in public accounts. Education (machine operation and programming; lack of skilled workers, low quality of education; technology management) … In International Conference on Information Technology Systems and Innovation (ICITSI), Bandung …","","https://scholar.google.com/scholar?q=related:1N5eqv8lD3oJ:scholar.google.com/&scioq=intitle:%22technology+management%22+technology+innovation&hl=en&as_sdt=2007&as_ylo=2021&as_yhi=2021"
0,"T Li","Artificial Intelligence Technology in Enterprise Economic Management",2021,"… Conference on Applications and Techniques in Cyber …","Springer","https://link.springer.com/chapter/10.1007/978-3-030-79200-8_21","",121,"2021-09-04 12:08:10","","10.1007/978-3-030-79200-8_21","","",,,,,0,0.00,0,1,1,"… business development strategy, and give corresponding strategic countermeasures in market promotion, strategic innovation, and enhancement of … intelligence technology and business, and can implement the latest artificial intelligence technology management methods in the …","","https://scholar.google.com/scholar?q=related:itgXCfEC9AkJ:scholar.google.com/&scioq=intitle:%22technology+management%22+technology+innovation&hl=en&as_sdt=2007&as_ylo=2021&as_yhi=2021"
0,"JJ Lohmer","Appendix for the article “Blockchain technology in operations & supply chain management: a content analysis”",2021,"","opara.zih.tu-dresden.de","https://opara.zih.tu-dresden.de/xmlui/bitstream/handle/123456789/1936/Appendix%20for%20Blockchain%20technology%20in%20operations%20%26%20supply%20chain%20management_%20a%20content%20analysis.pdf?sequence=1&isAllowed=y","",122,"2021-09-04 12:08:10","PDF","","","",,,,,0,0.00,0,1,1,"… 2020. “Supply Chain Finance Innovation Using Blockchain.” IEEE Transactions on Engineering Management 67 (4): 1045–1058 … 2020. “Blockchain Adoption in the Supply Chain: An Appraisal on Challenges.” Journal of Manufacturing Technology Management …","https://opara.zih.tu-dresden.de/xmlui/bitstream/handle/123456789/1936/Appendix%20for%20Blockchain%20technology%20in%20operations%20%26%20supply%20chain%20management_%20a%20content%20analysis.pdf?sequence=1&isAllowed=y",""
0,"SY Sepasia, A Basharat","The Impact of Information Technology on Supply Chain Management",,"jpit.ir","","http://jpit.ir/upload/jpit/paper/JPIT05P2932.pdf","",123,"2021-09-04 12:08:10","PDF","","","",,,,,0,0.00,0,2,,"… to stay competitive, they are facing many challenges that include expanding global competition, advancing technology and innovation, increasing customer … H. l. and Whang,S. (2000) Information Sharing in a Supply Chain, International Journal of Technology Management,20(3 …","http://jpit.ir/upload/jpit/paper/JPIT05P2932.pdf","https://scholar.google.com/scholar?q=related:mb8cJSlAJSEJ:scholar.google.com/&scioq=intitle:%22technology+management%22+technology+innovation&hl=en&as_sdt=2007&as_ylo=2021&as_yhi=2021"
0,"A Akhavan, M Zebarjady…","The Effect of Organizational Culture and Information-Communication Technology on Productivity, Services Quality, Customer Satisfaction, and Change Management …",2021,"The Journal of …","publish.kne-publishing.com","https://publish.kne-publishing.com/index.php/TBJ/article/view/6182","",124,"2021-09-04 12:08:10","","","","",,,,,0,0.00,0,3,1,"… This study investigated the simultaneous effects of organizational culture, information and communication technology, productivity, service quality, customer satisfaction, and management change on research innovation knowledge management …","https://publish.kne-publishing.com/index.php/TBJ/article/download/6182/5992","https://scholar.google.com/scholar?q=related:3iBhHF1OV5QJ:scholar.google.com/&scioq=intitle:%22technology+management%22+technology+innovation&hl=en&as_sdt=2007&as_ylo=2021&as_yhi=2021"
0,"S KURT, M MANSOR","International Journal of Engineering Technology Research & Management",,"ijetrm.com","","http://www.ijetrm.com/issues/files/Mar-2021-14-1615739659-M10.pdf","",125,"2021-09-04 12:08:10","PDF","","","",,,,,0,0.00,0,2,,"… These benefits are often obtained by small companies without sacrificing the innovation, rapid response capability, and individual contribution on which their success depends … Journal of manufacturing technology management …","http://www.ijetrm.com/issues/files/Mar-2021-14-1615739659-M10.pdf","https://scholar.google.com/scholar?q=related:G23FxAnxl7UJ:scholar.google.com/&scioq=intitle:%22technology+management%22+technology+innovation&hl=en&as_sdt=2007&as_ylo=2021&as_yhi=2021"
0,"B Alalwi, T Mazzuchi, A Hamdan…","Blockchain Technology Implications on Supply Chain Management: A Review of the Literature",2021,"Applications of Artificial …","Springer","https://link.springer.com/chapter/10.1007/978-3-030-72080-3_2","",126,"2021-09-04 12:08:10","","10.1007/978-3-030-72080-3_2","","",,,,,0,0.00,0,4,1,"… Accessed July 15, 2020 [Online]. Available: https://www2.deloitte.com/content/dam/Deloitte/us/ Documents/process-and-operations/us-blockchain-to-drive-supply-chain-innovation.pdf … Journal of Manufacturing Technology Management, 31(3), 441–457.CrossRefGoogle Scholar …","https://www.researchgate.net/profile/Abdulnaser-Nour-2/publication/353183312_Fourth_Industrial_Revolution_Artificial_Intelligence_Intellectual_Capital_and_COVID-19_Pandemic/links/60f9194f0c2bfa282af21485/Fourth-Industrial-Revolution-Artificial-Intelligence-Intellectual-Capital-and-COVID-19-Pandemic.pdf#page=31",""
0,"AK Choudhary, DS Yadav, P Sood, S Rahi, K Arya…","… , Enhanced Wheat Productivity, Profitability and Quality in North-Western Himalayas: A 'Participatory-Mode'Technology Development and Dissemination",2021,"Sustainability","mdpi.com","https://www.mdpi.com/2071-1050/13/10/5425","",127,"2021-09-04 12:08:10","HTML","","","",,,,,0,0.00,0,6,1,"… support. The financial and technical support provided by the World Bank funded project 'Agricultural Technology Management Agency (ATMA)' through Government of Himachal Pradesh, India is also highly acknowledged. The …","https://www.mdpi.com/2071-1050/13/10/5425","https://scholar.google.com/scholar?q=related:Z7ce9_GVM4EJ:scholar.google.com/&scioq=intitle:%22technology+management%22+technology+innovation&hl=en&as_sdt=2007&as_ylo=2021&as_yhi=2021"
