Cites,Authors,Title,Year,Source,Publisher,ArticleURL,CitesURL,GSRank,QueryDate,Type,DOI,ISSN,CitationURL,Volume,Issue,StartPage,EndPage,ECC,CitesPerYear,CitesPerAuthor,AuthorCount,Age,Abstract,FullTextURL,RelatedURL
0,"VGL Roberto","Using Analog Models based in Physical Systems for Technology Management Processes",2021,"Business and Management Studies","ideas.repec.org","https://ideas.repec.org/a/rfa/bmsjnl/v7y2021i1p59-73.html","",34,"2021-09-04 12:08:10","","","","",,,,,0,0.00,0,1,1,"… The empirical management work done in research, development and innovation projects (R & D + I) conducted at the liaison and … Finally, complementing the models with a good management theoretical dose will provide good technology management practitioners for all kind of …","",""
0,"PM Risqi, YI Handayani","The Effect of Information Technology Management on Customer Satisfaction in E-Bank Services",2021,"E-PROCEEDING STIE …","jurnal.stie-mandala.ac.id","http://jurnal.stie-mandala.ac.id/index.php/eproceeding/article/view/464","",35,"2021-09-04 12:08:10","","","","",,,,,0,0.00,0,2,1,"… Management on Customer Satisfaction in E-Bank Services … Technology-based banking activities in this era emerged as a strategic innovation for responding to changes and increase competitive power for customer convenience (Ho, Wu, Lee, & Pham, 2020) …","http://jurnal.stie-mandala.ac.id/index.php/eproceeding/article/download/464/433",""
0,"B Tangut","Cloud Technology Management in Public and Big Data Mining",2021,"… of Industrial Policy and Technology Management","jipat.org","http://jipat.org/index.php/jipat/article/view/57","",36,"2021-09-04 12:08:10","","","","",,,,,0,0.00,0,1,1,"… Cloud Technology Management in Public and Big Data Mining. Burçak Tangut. Abstract … License. Creative Commons Lisansı Journal of Industrial Policy and Technology Management is licensed under a Creative Commons Attribution-Gayriticari-NoDerivs 4.0 Unported License …","",""
0,"J Yan-Yan, T Shen","Capacity building of logistics enterprises' reverse inventory technology management based on value chain",,"Journal of Intelligent & Fuzzy Systems","content.iospress.com","https://content.iospress.com/articles/journal-of-intelligent-and-fuzzy-systems/ifs219049","",37,"2021-09-04 12:08:10","","","","",,,,,0,0.00,0,2,,"… Capacity building of logistics enterprises' reverse inventory technology management based on … Technologies For ManufacturingSystems[J], Engineering Science and Technology An InternationalJournal … Adner R. , Match Your Innovation Strategy to Your InnovationEcosystem …","","https://scholar.google.com/scholar?q=related:KxEYkLR8aZsJ:scholar.google.com/&scioq=intitle:%22technology+management%22+technology+innovation&hl=en&as_sdt=2007&as_ylo=2021&as_yhi=2021"
0,"S Wulandari, Y Ferry","Strategies on technology management for coffee smallholder to promote the smart farming implementation",2021,"IOP Conference Series: Earth and …","iopscience.iop.org","https://iopscience.iop.org/article/10.1088/1755-1315/759/1/012057/meta","",38,"2021-09-04 12:08:10","","","","",,,,,0,0.00,0,2,1,"… 3.4 Technology management for smallholder as strategies to implement smart farming The application of smart farming in smallholder plantations is … The farmers' organization has an important role in innovation and research on decision support systems and technical solutions …","https://iopscience.iop.org/article/10.1088/1755-1315/759/1/012057/pdf","https://scholar.google.com/scholar?q=related:t3mHb3dxho8J:scholar.google.com/&scioq=intitle:%22technology+management%22+technology+innovation&hl=en&as_sdt=2007&as_ylo=2021&as_yhi=2021"
0,"MA Noruozzadeh","The Effect of Applying Business Intelligence on Improvement of Information Technology Management (Case Study: Software Companies in Tehran Province)",2021,"Revista Eletrônica em Gestão, Educação e …","scholar.archive.org","https://scholar.archive.org/work/3tzm6bzx4vbq5ovd4jp73kte74/access/wayback/https://periodicos.ufsm.br/reget/article/download/63799/pdf","",39,"2021-09-04 12:08:10","PDF","","","",,,,,0,0.00,0,1,1,"… R e fe re n c e s Comparison of research findings (Research Innovations) … and medium enterprises (Case Study: Iran), International Conference on Innovation and Research … of Applying Business Intelligence on Improvement of Information Technology Management (Case Study …","https://scholar.archive.org/work/3tzm6bzx4vbq5ovd4jp73kte74/access/wayback/https://periodicos.ufsm.br/reget/article/download/63799/pdf","https://scholar.google.com/scholar?q=related:FpEkfQLt5vwJ:scholar.google.com/&scioq=intitle:%22technology+management%22+technology+innovation&hl=en&as_sdt=2007&as_ylo=2021&as_yhi=2021"
0,"P Zhou, C Jin, S Xiao, T Jiang","Research on schedule control method of EPC general contract project based on Technology Management",2021,"E3S Web of Conferences","e3s-conferences.org","https://www.e3s-conferences.org/articles/e3sconf/abs/2021/12/e3sconf_icersd2020_05051/e3sconf_icersd2020_05051.html","",40,"2021-09-04 12:08:10","","","","",,,,,0,0.00,0,4,1,"… project based on Technology Management … strategies, research trends, and base information for practitioners[J]. Information and software technology, 2018, 102(1 … 5. Bruce JR, De Figueiredo JM, Silverman B S. Public contracting for private innovation: Government capabilities …","https://www.e3s-conferences.org/articles/e3sconf/pdf/2021/12/e3sconf_icersd2020_05051.pdf","https://scholar.google.com/scholar?q=related:XHmo5zq2ssAJ:scholar.google.com/&scioq=intitle:%22technology+management%22+technology+innovation&hl=en&as_sdt=2007&as_ylo=2021&as_yhi=2021"
3,"LEEW SWANSON","ENTREPRENEURSHIP, INNOVATION AND TECHNOLOGY MANAGEMENT.",2021,"","KENDALL HUNT","","https://scholar.google.com/scholar?cites=15202423565130540800&as_sdt=2005&sciodt=2007&hl=en",41,"2021-09-04 12:08:10","CITATION","","","",,,,,3,3.00,3,1,1,"","","https://scholar.google.com/scholar?q=related:ACeixK_b-dIJ:scholar.google.com/&scioq=intitle:%22technology+management%22+technology+innovation&hl=en&as_sdt=2007&as_ylo=2021&as_yhi=2021"
0,"X Wang, Y Zhang, D Wang","Impact of the Stress Status of Employees on the Enterprise Technology Management Cost Through Matter-Element Analysis Under Psychological Health …",2021,"Frontiers in Psychology","frontiersin.org","https://www.frontiersin.org/articles/10.3389/fpsyg.2021.593813/pdf","",42,"2021-09-04 12:08:10","PDF","","","",,,,,0,0.00,0,3,1,"… of technical equipment, the output value, informatization of technology management, and national … Technology acceptance model-based research on differences of enterprise resources planning … Measurement model and its application of enterprise innovation capability based …","https://www.frontiersin.org/articles/10.3389/fpsyg.2021.593813/pdf",""
0,"Z Moreno Freites, C Esposito","Technology management and organic law of science, technology and innovation (LOCTI): an analysis from the perspective of the venezuelan business …",2021,"","repositorio.itm.edu.co","https://repositorio.itm.edu.co/handle/20.500.12622/5042","",43,"2021-09-04 12:08:10","CITATION","","","",,,,,0,0.00,0,2,1,"Technological surveillance and analysis of the technology life cycle: Evaluation of the commercial potential of a prototype of biodegradable gloves made out thermoplastic starch from cassava [Vigilancia tecnológica y análisis del ciclo de vida de la tecnología: Evaluación …","",""
0,"J Morabito, AM Mariani","Healthcare Technology Management Professionals Are Influential for Device Safety and Reliability: A Patient Monitoring Device Malfunction Case Study",2021,"Journal of Clinical Engineering","journals.lww.com","https://journals.lww.com/jcejournal/Fulltext/2021/01000/Healthcare_Technology_Management_Professionals_Are.10.aspx?context=LatestArticles","",44,"2021-09-04 12:08:10","","","","",,,,,0,0.00,0,2,1,"… manufacturers, regulatory agencies, and device end users, including hospital-based clinicians and Healthcare Technology Management (HTM) professionals … medical devices continue to be available to the public and facilitate medical device innovation and improvements …","",""
1,"J de Almeida Ribeiro, MB Ladeira, AF de Faria…","A reference model for science and technology parks strategic performance management: An emerging economy perspective",2021,"… Management","Elsevier","https://www.sciencedirect.com/science/article/pii/S0923474821000011","https://scholar.google.com/scholar?cites=5124025012631360028&as_sdt=2005&sciodt=2007&hl=en",45,"2021-09-04 12:08:10","","","","",,,,,1,1.00,0,4,1,"… Volume 59, January–March 2021, 101612. Journal of Engineering and Technology Management … an incentive of the university-company relationship, in the pursuit of scientific and technological development and innovations … Joinville Technology Innovation Park, 6, Consulting, 5 …","","https://scholar.google.com/scholar?q=related:HNIbypkxHEcJ:scholar.google.com/&scioq=intitle:%22technology+management%22+technology+innovation&hl=en&as_sdt=2007&as_ylo=2021&as_yhi=2021"
0,"D Juan","Research on Personnel File Management Based on Computer Information Technology",2021,"Journal of Physics: Conference Series","iopscience.iop.org","https://iopscience.iop.org/article/10.1088/1742-6596/1827/1/012187/meta","",46,"2021-09-04 12:08:10","","","","",,,,,0,0.00,0,1,1,"… In addition, technology management will be promoted -- information resources integration and utilization -- innovative service management will be effectively related; To form a technology management center to improve the use of resources and service innovation methods …","https://iopscience.iop.org/article/10.1088/1742-6596/1827/1/012187/pdf",""
0,"TQ Huy, TTH Giang, C Van Tung","ENHANCING SCIENCE AND TECHNOLOGY HUMAN RESOURCES MANAGEMENT FROM THE COMPETENCY-BASED APPROACH IN VIETNAM",,"researchgate.net","","https://www.researchgate.net/profile/Tran-Huy-8/publication/349857136_ENHANCING_SCIENCE_AND_TECHNOLOGY_HUMAN_RESOURCES_MANAGEMENT_FROM_THE_COMPETENCY-BASED_APPROACH_IN_VIETNAM/links/60443dc2299bf1e0785f6de9/ENHANCING-SCIENCE-AND-TECHNOLOGY-HUMAN-RESOURCES-MANAGEMENT-FROM-THE-COMPETENCY-BASED-APPROACH-IN-VIETNAM.pdf","",47,"2021-09-04 12:08:10","PDF","","","",,,,,0,0.00,0,3,,"… According to a report by ITAC Talent (2016), Canada had built and implemented the Business Technology Management Program (BTM) which is based on … in 5 sectors: (i) Data safety; (ii) Financial services; (iii) Health cares; (iv) Data analysis; and (v) Business and innovation …","https://www.researchgate.net/profile/Tran-Huy-8/publication/349857136_ENHANCING_SCIENCE_AND_TECHNOLOGY_HUMAN_RESOURCES_MANAGEMENT_FROM_THE_COMPETENCY-BASED_APPROACH_IN_VIETNAM/links/60443dc2299bf1e0785f6de9/ENHANCING-SCIENCE-AND-TECHNOLOGY-HUMAN-RESOURCES-MANAGEMENT-FROM-THE-COMPETENCY-BASED-APPROACH-IN-VIETNAM.pdf","https://scholar.google.com/scholar?q=related:M08T3N_xODsJ:scholar.google.com/&scioq=intitle:%22technology+management%22+technology+innovation&hl=en&as_sdt=2007&as_ylo=2021&as_yhi=2021"
0,"R Giasolli, A Groen, R Haak, M Pieck","Identifying Management of Technology and innovation (MOT) and Technology Entrepreneurship (TE) centers of excellence",2021,"Technological Forecasting and …","Elsevier","https://www.sciencedirect.com/science/article/pii/S0040162521005072","",48,"2021-09-04 12:08:10","","","","",,,,,0,0.00,0,4,1,"… of Product Innovation Management, 1984, 5.270. R & D Management, 1970, 2.908. IEEE Transactions on Engineering Management, 1954, 2.784. Technological Analysis and Strategic Management, 1989, 1.867. Journal of Engineering and Technology Management, 1984, 1.957 …","",""
1,"J Patnaik, B Bhowmick","Determining appropriateness for management of appropriate technology: an empirical study using factor analysis",2021,"Technology Analysis & Strategic …","Taylor & Francis","https://www.tandfonline.com/doi/abs/10.1080/09537325.2021.1890013","https://scholar.google.com/scholar?cites=4176418280499516880&as_sdt=2005&sciodt=2007&hl=en",49,"2021-09-04 12:08:10","","10.1080/09537325.2021.1890013","","",,,,,1,1.00,1,2,1,"… Regardless of such limitations, the study has significantly contributed to the literature on AT and technology management at the grassroots … Her research interest lies in Appropriate Technology, Technological Innovation, Sustainability … “Appropriate Technology Assessment: A …","","https://scholar.google.com/scholar?q=related:0BWfakye9TkJ:scholar.google.com/&scioq=intitle:%22technology+management%22+technology+innovation&hl=en&as_sdt=2007&as_ylo=2021&as_yhi=2021"
0,"Y Qi","Research on the Innovation and Application of Cloud Technology in the Construction of Management Laboratory",2021,"Journal of Physics: Conference Series","iopscience.iop.org","https://iopscience.iop.org/article/10.1088/1742-6596/1883/1/012051/meta","",50,"2021-09-04 12:08:10","","","","",,,,,0,0.00,0,1,1,"… the school can use more information technology and cloud technology to promote the innovation and development … is based on cloud computing business model application of network technology, information technology, integration technology, management platform technology …","https://iopscience.iop.org/article/10.1088/1742-6596/1883/1/012051/pdf",""
0,"JN Kumar, B Pankaj, S Kuldeep…","Assessment of Computerized Medical Equipment Management and Maintenance System From Health Technology Assessment (HTA) Perspective: Need and …",2021,"Health Technology …","publish.kne-publishing.com","https://publish.kne-publishing.com/index.php/HTAA/article/view/6232","",51,"2021-09-04 12:08:10","","","","",,,,,0,0.00,0,4,1,"… system (CMMS) is a computerized program used by healthcare technology management (HTM) systems … Health Technology assessment (HTA) is a systematic process designed to synthesize and evaluate the prevailing evidence for treatment or health delivery innovation …","",""
0,"K Nazemi, D Burkhardt, A Kock","Visual analytics for technology and innovation management",2021,"Multimedia Tools and Applications","Springer","https://link.springer.com/article/10.1007/s11042-021-10972-3","",52,"2021-09-04 12:08:10","HTML","10.1007/s11042-021-10972-3","","",,,,,0,0.00,0,3,1,"… These aspects are crucial to understand the background of the introduced analytics system for technology management and foresight … Thereafter, we introduce our interaction design approach specific for the application context technology and innovation management …","https://link.springer.com/article/10.1007/s11042-021-10972-3","https://scholar.google.com/scholar?q=related:-Oy9jL9e-BgJ:scholar.google.com/&scioq=intitle:%22technology+management%22+technology+innovation&hl=en&as_sdt=2007&as_ylo=2021&as_yhi=2021"
8,"C Martin-Rios, A Hofmann, N Mackenzie","Sustainability-oriented innovations in food waste management technology",2021,"Sustainability","mdpi.com","https://www.mdpi.com/938878","https://scholar.google.com/scholar?cites=4164614407699017502&as_sdt=2005&sciodt=2007&hl=en",53,"2021-09-04 12:08:10","","","","",,,,,8,8.00,3,3,1,"… innovations to quantify and minimize wastage via collaborations with third-party companies can be a strategic and cost-effective way to supplement a company's open innovation activities. Keywords: food waste; sustainability-oriented innovation; technology; management; food …","https://www.mdpi.com/2071-1050/13/1/210/pdf","https://scholar.google.com/scholar?q=related:Hq9fHb2uyzkJ:scholar.google.com/&scioq=intitle:%22technology+management%22+technology+innovation&hl=en&as_sdt=2007&as_ylo=2021&as_yhi=2021"
0,"JC Liu, M Yeats","科技管理學刊學術倫理爭議事件 (An Academic Ethics Issue in the Journal of Technology Management)",2021,"","papers.ssrn.com","https://papers.ssrn.com/sol3/papers.cfm?abstract_id=3824923","",54,"2021-09-04 12:08:10","","","","",,,,,0,0.00,0,2,1,"… 製造業高值化之設 計創新與分析。科技管理學刊，21(4)，65 -96。Lee, ZY, Tsai, CH, Chen, SS, & Cheng, CL (2016). Analysis and design innovation of in the high-valued manufacturing. Journal of Technology Management, 21(4), 65-96 …","","https://scholar.google.com/scholar?q=related:kW3kwHid4hgJ:scholar.google.com/&scioq=intitle:%22technology+management%22+technology+innovation&hl=en&as_sdt=2007&as_ylo=2021&as_yhi=2021"
1,"J Zhao","Knowledge management capability and technology uncertainty: driving factors of dual innovation",2021,"Technology Analysis & Strategic Management","Taylor & Francis","https://www.tandfonline.com/doi/abs/10.1080/09537325.2020.1841896","https://scholar.google.com/scholar?cites=1947612624718660848&as_sdt=2005&sciodt=2007&hl=en",55,"2021-09-04 12:08:10","","10.1080/09537325.2020.1841896","","",,,,,1,1.00,1,1,1,"… if enterprises want to maintain their lasting competitiveness, they must upgrade their technology and implement breakthrough innovations … “The Interactive Influence of Dual Learning on Dual Innovation and its Synergy.” Science and Technology Management Research 36 …","","https://scholar.google.com/scholar?q=related:8ARsAF1PBxsJ:scholar.google.com/&scioq=intitle:%22technology+management%22+technology+innovation&hl=en&as_sdt=2007&as_ylo=2021&as_yhi=2021"
0,"J Carlos Rodriguez, M Gomez…","High-performance level and technology management among winery firms in the wine industry cluster of Baja CCalifornia: a fsQCA approach",2021,"RAE-REVISTA …","… EMPRESAS SAO PAULO, AV 9 DE …","","",56,"2021-09-04 12:08:10","CITATION","","","",,,,,0,0.00,0,3,1,"","",""
0,"I Abouddaka, M Bassiri, A Atibi, M Tridane…","The Engineering of E-governance and Technology in the Management of Secondary Schools: Case of the Nouaceur Delegation",2021,"… Management","jitm.ut.ac.ir","https://jitm.ut.ac.ir/mobile/article_82620.html","",57,"2021-09-04 12:08:10","","","","",,,,,0,0.00,0,5,1,"… During the past decade, we note that the Moroccan education system has continued to use new managerial approaches in the search for innovation and modernization of the public administrative sector … 233 Journal of Information Technology Management, 2021, Special Issue …","https://jitm.ut.ac.ir/article_82620_117105aea833251bdf8f4627f4086e5b.pdf",""
0,"MRSAM Ahmed, MRSFO Badiru, MA Nasiru","OFFICE TECHNOLOGY AND MANAGEMENT EDUCATION (BES 324)",,"businesseducationfcezaria.com","","https://businesseducationfcezaria.com/wp-content/uploads/2021/03/BES-324-office-technology-and-management.pdf","",58,"2021-09-04 12:08:10","PDF","","","",,,,,0,0.00,0,3,,"… Other higher qualifications which a secretary should possess include; National Diploma (ND) in Office Technology Management (OTM), Higher National Diploma (HND) in OTM, a Bachelor … innovations and advancement in information and communication technology (ICT) …","https://businesseducationfcezaria.com/wp-content/uploads/2021/03/BES-324-office-technology-and-management.pdf","https://scholar.google.com/scholar?q=related:PFkLQ1uh6CEJ:scholar.google.com/&scioq=intitle:%22technology+management%22+technology+innovation&hl=en&as_sdt=2007&as_ylo=2021&as_yhi=2021"
0,"A Mutakyahwa, C Marnewick","Information technology governance practices and stakeholder management: A multinational organisational perspective",2021,"The Journal of Modern …","journalmodernpm.com","https://www.journalmodernpm.com/index.php/jmpm/article/view/JMPM02608","",59,"2021-09-04 12:08:10","","","","",,,,,0,0.00,0,2,1,"… About The Authors Augustine Mutakyahwa Department of Applied Information Systems, University of Johannesburg South Africa. Augustine A. Mutakyahwa is a PhD candidate in Information Technology Management (ITM) at the University of Johannesburg, South Africa …","",""
0,"H Zhang","Computer Information Technology Application in the Engineering Cost Information Management Research",2021,"Journal of Physics: Conference Series","iopscience.iop.org","https://iopscience.iop.org/article/10.1088/1742-6596/1881/2/022039/meta","",60,"2021-09-04 12:08:10","","","","",,,,,0,0.00,0,1,1,"… the application of information technology in enterprises, especially in the application of information management and innovation, make managers to … To be specific, the engineering cost information of computer information technology management has advantages such as high …","https://iopscience.iop.org/article/10.1088/1742-6596/1881/2/022039/pdf","https://scholar.google.com/scholar?q=related:-xmUNh4x6X8J:scholar.google.com/&scioq=intitle:%22technology+management%22+technology+innovation&hl=en&as_sdt=2007&as_ylo=2021&as_yhi=2021"
0,"G Lu, Z Sun","Automation Technology in Equipment Installation Technology and Quality Management",2021,"Journal of Physics: Conference Series","iopscience.iop.org","https://iopscience.iop.org/article/10.1088/1742-6596/1744/2/022116/meta","",61,"2021-09-04 12:08:10","","","","",,,,,0,0.00,0,2,1,"… Therefore, strengthening equipment technology management to reduce equipment life cycle costs and many other aspects occupy a very important position … In the past ten years or so, the independent innovation research of coal mining technology and equipment that has …","https://iopscience.iop.org/article/10.1088/1742-6596/1744/2/022116/pdf","https://scholar.google.com/scholar?q=related:wIWTSDhi-JYJ:scholar.google.com/&scioq=intitle:%22technology+management%22+technology+innovation&hl=en&as_sdt=2007&as_ylo=2021&as_yhi=2021"
0,"C Yáñez-Valdés, M Guerrero…","Innovation Mechanisms based on Management of Business and Technology Knowledge Networks",2021,"… IEEE Technology & …","ieeexplore.ieee.org","https://ieeexplore.ieee.org/abstract/document/9488656/","",62,"2021-09-04 12:08:10","","","","",,,,,0,0.00,0,3,1,"… Motivation to innovate is an important issue for the development of demand-driven innovations, as innovative new products … While innovation can be decisive for the achievement of sustainable outcomes, successful innovation is also expected to be … Technology Management …","",""
0,"C Ou","Teaching Management Work Model of Higher Vocational Colleges Based on Computer Technology",2021,"Journal of Physics: Conference Series","iopscience.iop.org","https://iopscience.iop.org/article/10.1088/1742-6596/1881/2/022077/meta","",63,"2021-09-04 12:08:10","","","","",,,,,0,0.00,0,1,1,"… opportunities. In meeting these challenges and opportunities, higher vocational colleges should use computer technology management methods and innovations derived from computer technology. The method is applied well …","https://iopscience.iop.org/article/10.1088/1742-6596/1881/2/022077/pdf","https://scholar.google.com/scholar?q=related:_Cse92pqbMEJ:scholar.google.com/&scioq=intitle:%22technology+management%22+technology+innovation&hl=en&as_sdt=2007&as_ylo=2021&as_yhi=2021"
0,"V Narayanan, Y Baburaj","Technology Standardization in Innovation Management",2021,"Oxford Research Encyclopedia of Business …","oxfordre.com","https://oxfordre.com/business/view/10.1093/acrefore/9780190224851.001.0001/acrefore-9780190224851-e-340","",64,"2021-09-04 12:08:10","","","","",,,,,0,0.00,0,2,1,"… spurring innovation in upstream and downstream markets (Blind, 2009; Swann, 2010). Moreover, collaborative promotion of fragmented technology standards through formation of patent pools around a technology standard has a positive impact on subsequent innovations and …","",""
0,"T Hockaday, A Piccaluga","University Technology Transfer in Innovation Management",2021,"Oxford Research Encyclopedia of Business …","oxfordre.com","https://oxfordre.com/business/view/10.1093/acrefore/9780190224851.001.0001/acrefore-9780190224851-e-295","",65,"2021-09-04 12:08:10","","","","",,,,,0,0.00,0,2,1,"… Managing knowledge-transfer within multinational firms. International Journal of Technology Management, 12(4), 462–476 … Markman, GD, Gianiodis, PT, Phan, HP, & Balkin, DB (2005). Innovation speed: Transferring university technology to market …","","https://scholar.google.com/scholar?q=related:Di4oTNHgYoEJ:scholar.google.com/&scioq=intitle:%22technology+management%22+technology+innovation&hl=en&as_sdt=2007&as_ylo=2021&as_yhi=2021"
0,"MJ de Vries","Innovation Research in Technology and Engineering Management: A Philosophical Approach",2021,"","taylorfrancis.com","https://www.taylorfrancis.com/books/mono/10.4324/9781003013556/innovation-research-technology-engineering-management-marc-de-vries","",66,"2021-09-04 12:08:10","BOOK","","","",,,,,0,0.00,0,1,1,"… In the next chapter, Chapter 7, the way innovations can be and are assessed and valued is discussed … Page 12. 4 Introduction in product innovation management … Biomimicry: Design by Analogy to Biology. Research-Technology Management, 60(6), 51–56 …","https://scholar.archive.org/work/pugbjf7bqrc5hofsu6gfhcovea/access/wayback/https://s3-euw1-ap-pe-ws4-capi2-distribution-p.s3.eu-west-1.amazonaws.com/books/9781003013556/HUB/googleScholarPdf.pdf?response-content-disposition=attachment%3B%20filename%3D%229781003013556_googlepreview.pdf%22&response-content-type=application%2Fpdf&X-Amz-Algorithm=AWS4-HMAC-SHA256&X-Amz-Date=20210211T052541Z&X-Amz-SignedHeaders=host&X-Amz-Expires=604799&X-Amz-Credential=AKIAQFVOSJ57SSJPZ65S%2F20210211%2Feu-west-1%2Fs3%2Faws4_request&X-Amz-Signature=f46f1fd20455f3fcca9479a1510a7d6eb49b871db90cb5bd7c1d33796cf7224b","https://scholar.google.com/scholar?q=related:trJbJPmTWDsJ:scholar.google.com/&scioq=intitle:%22technology+management%22+technology+innovation&hl=en&as_sdt=2007&as_ylo=2021&as_yhi=2021"
