Cites,Authors,Title,Year,Source,Publisher,ArticleURL,CitesURL,GSRank,QueryDate,Type,DOI,ISSN,CitationURL,Volume,Issue,StartPage,EndPage,ECC,CitesPerYear,CitesPerAuthor,AuthorCount,Age,Abstract,FullTextURL,RelatedURL
1,"M Dweiri, A Shatat","The effects of knowledge management and advanced technology on innovative capabilit",2021,"Management Science Letters","m.growingscience.com","http://m.growingscience.com/beta/msl/4560-the-effects-of-knowledge-management-and-advanced-technology-on-innovative-capabilit.html","https://scholar.google.com/scholar?cites=13473872309372281668&as_sdt=2005&sciodt=2007&hl=en",67,"2021-09-04 12:08:10","","","","",,,,,1,1.00,1,2,1,"… The Journal of High Technology Management Research, 12(1), 139-165. Schulze, A., Brojerdi, G., & von Krogh, G. (2014) … Service innovation through dynamic knowledge management … Factors affecting service innovations in FM service sector. Facilities, 30, 517-530 …","http://m.growingscience.com/msl/Vol11/msl_2021_3.pdf","https://scholar.google.com/scholar?q=related:RGMbTXrP_LoJ:scholar.google.com/&scioq=intitle:%22technology+management%22+technology+innovation&hl=en&as_sdt=2007&as_ylo=2021&as_yhi=2021"
0,"M Novalensiago, F Satyani","HOW KNOWLEDGE MANAGEMENT, SUSTAINABLE TECHNOLOGY, AND INNOVATIONS ARE IMPACTING BUSINESS SUSTAINABILITY",2021,"Fortunate Business Review","journal.uvers2.ac.id","http://journal.uvers2.ac.id/index.php/fbr/article/view/13","",68,"2021-09-04 12:08:10","","","","",,,,,0,0.00,0,2,1,"… Keywords: business sustainability, knowledge management, sustainable technology, innovations … Journal of Engineering and Technology Management - JET-M. https://doi.org/10.1016/j.jengtecman. 2013.09.005 Forsman … Innovation and business performance in small enterprises …","http://journal.uvers2.ac.id/index.php/fbr/article/download/13/6","https://scholar.google.com/scholar?q=related:Qg8WgTpDvZUJ:scholar.google.com/&scioq=intitle:%22technology+management%22+technology+innovation&hl=en&as_sdt=2007&as_ylo=2021&as_yhi=2021"
5,"JC Acosta-Prado, JFF Navarrete…","Relationship between conditions of knowledge management and innovation capability in new technology-based firms",2021,"… Journal of Innovation …","World Scientific","https://www.worldscientific.com/doi/abs/10.1142/S1363919621500055","https://scholar.google.com/scholar?cites=3441533699673287351&as_sdt=2005&sciodt=2007&hl=en",69,"2021-09-04 12:08:10","","10.1142/S1363919621500055","","",,,,,5,5.00,2,3,1,"… The exploitation, on the other hand, responds to a more incremental criterion, giving rise to successive innovations, which improve one or more of the attributes of a product … Inter- national Journal Technology Management, 41(1–2), 155–168 … The Management of Innovation …","","https://scholar.google.com/scholar?q=related:t-qPc6rIwi8J:scholar.google.com/&scioq=intitle:%22technology+management%22+technology+innovation&hl=en&as_sdt=2007&as_ylo=2021&as_yhi=2021"
0,"C Zhang","Application of Big Data Technology in Financial Management Teaching",2021,"2021 International Wireless Communications and …","ieeexplore.ieee.org","https://ieeexplore.ieee.org/abstract/document/9498860/","",70,"2021-09-04 12:08:10","","","","",,,,,0,0.00,0,1,1,"… Keywords—big data technology, management application, education and teaching I. APPLICATION OF BIG DATA TECHNOLOGY IN INNOVATION AND ENTREPRENEURSHIP EDUCATION A. The Course of Big Data The course of big data in financial management can …","",""
0,"M Othman, NA Kamarohim","… Relationship Management (CRM) System in Telecommunication Industry: A framework Proposal on the CRM, Information Technology Governance and Organizational …",2021,"… and Technology Management","myjms.mohe.gov.my","http://myjms.mohe.gov.my/index.php/ijbtm/article/view/14540","",71,"2021-09-04 12:08:10","","","","",,,,,0,0.00,0,2,1,"… the linkage among open innovation, customer knowledge management and radical innovation: The multiple mediating effects of organizational learning ability. Baltic Journal of Management. Page 12. International Journal of Business and Technology Management e-ISSN: 2682 …","http://myjms.mohe.gov.my/index.php/ijbtm/article/download/14540/7516",""
0,"M Xie","Application and Exploration of Computer Technology In Modern Enterprise Logistics Management",2021,"Journal of Physics: Conference Series","iopscience.iop.org","https://iopscience.iop.org/article/10.1088/1742-6596/1992/3/032061/meta","",72,"2021-09-04 12:08:10","","","","",,,,,0,0.00,0,1,1,"… to the current job change affects the working efficiency at the same time, also influence the innovation effect of … Advantages of computer information technology management The enterprise establishes the management system through the computer technology, and obtains the …","https://iopscience.iop.org/article/10.1088/1742-6596/1992/3/032061/pdf",""
0,"SX Ribeiro, MS Nagano","On the relation between knowledge management and university-industry-government collaboration in Brazilian national institutes of science and technology",2021,"VINE Journal of Information and Knowledge …","emerald.com","https://www.emerald.com/insight/content/doi/10.1108/VJIKMS-01-2020-0002/full/html","",73,"2021-09-04 12:08:10","","10.1108/VJIKMS-01-2020-0002","","",,,,,0,0.00,0,2,1,"… INCT is a program of the greatest importance for science, technology and innovation … for comparative evaluations of INCT with other programs toward innovation and university … INCT program but could develop measures that would help implement innovations, encouraging and …","",""
0,"J Ipmawati, Y Hendriana","KNOWLEDGE MANAGEMENT TECHNOLOGY USING SECI AND WIL TO IMPROVE PERFORMANCE OF IN-FORMATION TECHNOLOGY DIVISION IN PANGESTU …",2021,"… TECHNOLOGY …","journal.universitasmulia.ac.id","http://journal.universitasmulia.ac.id/index.php/mst/article/view/206","",74,"2021-09-04 12:08:10","","","","",,,,,0,0.00,0,2,1,"… as an asset to improve the performance of human resources within the company [5]. Within the area of innovation and technology management education, the … [31] J. Bessant and H. Rush, “Building bridges for innovation: the role of consultants in technology transfer,” Res …","http://journal.universitasmulia.ac.id/index.php/mst/article/download/206/178","https://scholar.google.com/scholar?q=related:LHeDh43FDqcJ:scholar.google.com/&scioq=intitle:%22technology+management%22+technology+innovation&hl=en&as_sdt=2007&as_ylo=2021&as_yhi=2021"
0,"D Jielan, X Qijun, Y Huifang, L Yixuan…","Research Trends of Science, Technology and Innovation Management and Policy: A Bibliometric Analysis Based on WoS Publications",2021,"Science …","manu56.magtech.com.cn","http://manu56.magtech.com.cn/kxgc/EN/abstract/abstract906.shtml","",75,"2021-09-04 12:08:10","","","","",,,,,0,0.00,0,5,1,"… FORECASTING AND SOCIAL CHANGE JOURNAL OF PRODUCT INNOVATION MANAGEMENT STRATEGIC … TECHNOVATION FUTURES ORGANIZATION SCIENCE INTERNATIONAL JOURNAL OF TECHNOLOGY MANAGEMENT TECHNOLOGY ANALYSIS & STRATEGIC …","http://manu56.magtech.com.cn/kxgc/EN/article/downloadArticleFile.do?attachType=PDF&id=906","https://scholar.google.com/scholar?q=related:I-hCsr5WqIoJ:scholar.google.com/&scioq=intitle:%22technology+management%22+technology+innovation&hl=en&as_sdt=2007&as_ylo=2021&as_yhi=2021"
0,"J Yue","Construction Project Management Based on Computer Information Technology",2021,"… Conference on Applications and Techniques in Cyber …","Springer","https://link.springer.com/chapter/10.1007/978-3-030-79197-1_27","",76,"2021-09-04 12:08:10","","10.1007/978-3-030-79197-1_27","","",,,,,0,0.00,0,1,1,"… industry, is faced with great challenges under the promotion of computer information technology innovation … Construction engineering management Information technology Management software Construction engineering information management. Download conference paper …","",""
0,"Z Rusmawati, N Soewarno","The role of green technology to investigate green supply chain management practice and firm performance",2021,"Uncertain Supply Chain …","growingscience.com","http://growingscience.com/beta/uscm/4757-the-role-of-green-technology-to-investigate-green-supply-chain-management-practice-and-firm-performance.html","",77,"2021-09-04 12:08:10","","","","",,,,,0,0.00,0,2,1,"… Journal of Manufacturing Technology Management, 20(7). Heinkel, R., Kraus, A., & Zechner, J. (2015) … Industry and Innovation, 18(03), 249-253 … The behavioural aspect of green technology investments: A general positive model in the context of heterogeneous agents …","http://growingscience.com/uscm/Vol9/uscm_2021_8.pdf","https://scholar.google.com/scholar?q=related:MkFzrRqr6n8J:scholar.google.com/&scioq=intitle:%22technology+management%22+technology+innovation&hl=en&as_sdt=2007&as_ylo=2021&as_yhi=2021"
0,"R Zhou, J Ji","How to Optimize the Management of Science and Technology Funds in Colleges and Universities Based on the Policy of Streamlining Administration, Delegating …",2021,"Journal of Contemporary Educational Research","ojs.bbwpublisher.com","http://ojs.bbwpublisher.com/index.php/JCER/article/view/2124","",78,"2021-09-04 12:08:10","","","","",,,,,0,0.00,0,2,1,"… field of science and technology, we need to revitalize the development of science and technology through innovation … powers, improving regulation, and strengthening services; Colleges and universities; Funding for science and technology; Management strategy Publication …","http://ojs.bbwpublisher.com/index.php/JCER/article/view/2124/1954",""
0,"A Hermawan","MANAGEMENT PARTICIPATION IN HUMAN RESOURCES AND INFORMATION TECHNOLOGY ON THE EFFECTIVENESS OF INFORMATION SYSTEMS (Studies …",2021,"… on Economic and Business Innovation","jurnal.widyagama.ac.id","https://jurnal.widyagama.ac.id/index.php/cebi/article/view/150","",79,"2021-09-04 12:08:10","","","","",,,,,0,0.00,0,1,1,"… Conference on Economic and Business Innovation … 3. Management participation and its relationship with information technology Management participation in the development of information systems in terms of its position in the steering committee for information technology …","https://jurnal.widyagama.ac.id/index.php/cebi/article/download/150/100","https://scholar.google.com/scholar?q=related:sAWaXHR6fl8J:scholar.google.com/&scioq=intitle:%22technology+management%22+technology+innovation&hl=en&as_sdt=2007&as_ylo=2021&as_yhi=2021"
0,"I Estrada, H Zhou","Beyond the scope of the deal: configuration of technology alliance portfolios and the introduction of management innovation",2021,"British Journal of Management","Wiley Online Library","https://onlinelibrary.wiley.com/doi/abs/10.1111/1467-8551.12488","",80,"2021-09-04 12:08:10","","10.1111/1467-8551.12488","","",,,,,0,0.00,0,2,1,"… 1We define technology alliances as collaborative agree- ments between independent organizations for technologi- cal innovation activities, such as the development of prod- uct and process innovations (eg De Man and Duysters, 2005). © 2021 The Authors …","https://onlinelibrary.wiley.com/doi/pdf/10.1111/1467-8551.12488","https://scholar.google.com/scholar?q=related:jTPf9TEU3dgJ:scholar.google.com/&scioq=intitle:%22technology+management%22+technology+innovation&hl=en&as_sdt=2007&as_ylo=2021&as_yhi=2021"
1,"S Dong","On the Integration of Computer Application Technology and Information Management",2021,"Journal of Physics: Conference Series","iopscience.iop.org","https://iopscience.iop.org/article/10.1088/1742-6596/1744/3/032236/meta","https://scholar.google.com/scholar?cites=9941621605293269753&as_sdt=2005&sciodt=2007&hl=en",81,"2021-09-04 12:08:10","","","","",,,,,1,1.00,1,1,1,"… The information blowout needs the integration of information technology management system to improve the utilization rate of … Playing the role of computer technology in promoting information management, relying on computer innovation information management …","https://iopscience.iop.org/article/10.1088/1742-6596/1744/3/032236/pdf","https://scholar.google.com/scholar?q=related:-aLaUi2894kJ:scholar.google.com/&scioq=intitle:%22technology+management%22+technology+innovation&hl=en&as_sdt=2007&as_ylo=2021&as_yhi=2021"
0,"B Ang, A Ang, M Brandt, DF Denison","Albrecht, Dean, Hansen, 2005 Albrecht, CC, Dean, DL, & Hansen, JV (2005). Marketplace and technology standards for B2B e-commerce: progress, challenges, and …",2021,"","emerald.com","https://www.emerald.com/insight/content/doi/10.1108/978-1-80043-810-120211011/full/www.Cheshirehenbury.com/Agility/Ampapers.html","",82,"2021-09-04 12:08:10","","10.1108/978-1-80043-810-120211011","","",,,,,0,0.00,0,4,1,"… governance of IT In S. De Haes, W. Van Grembergen, A. Joshi, & T. Huygh (Eds.), Enterprise Governance of Information Technology: Management for Professionals … Going beyond the dominant paradigm for information technology innovation research: Emerging Concepts …","","https://scholar.google.com/scholar?q=related:9sP8AWjQ0VYJ:scholar.google.com/&scioq=intitle:%22technology+management%22+technology+innovation&hl=en&as_sdt=2007&as_ylo=2021&as_yhi=2021"
0,"S Komarov, M Kudina, G Suzdaleva…","Lean management as the innovative technology of an enterprise",2021,"SHS Web of …","shs-conferences.org","https://www.shs-conferences.org/articles/shsconf/abs/2021/27/shsconf_icsr2021_00008/shsconf_icsr2021_00008.html","",83,"2021-09-04 12:08:10","","","","",,,,,0,0.00,0,4,1,"… 5. E. Dolzhenkova, L. Iurieva, Proceedings of the international conference on trends of technologies and innovations in economic and social studies, 38, 132-138 (2017). 6. T. Goldsby … 16. ZB Yordanova, International journal of innovation and technology management, 15 (2 …","https://www.shs-conferences.org/articles/shsconf/pdf/2021/27/shsconf_icsr2021_00008.pdf",""
0,"RK Jain","ENABLING THE MANAGEMENT EVOLUTION IN INFORMATION TECHNOLOGY DOMAIN: ANALYZING THE INCREMENTAL AND TANGIBLE MANAGEMENT BY …",2021,"International Journal of Modern Agriculture","modern-journals.com","http://modern-journals.com/index.php/ijma/article/view/857","",84,"2021-09-04 12:08:10","","","","",,,,,0,0.00,0,1,1,"… “The Effects of MIS Steering Committees on Information Technology Management Sophistication” … Information Technology, Knowledge enterprise 52 … “Cross-Border Innovation in the Multinational Corporation: A Research Agenda” “Ivo Zander & Örjan Sölvell” 2000 …","http://modern-journals.com/index.php/ijma/article/download/857/750","https://scholar.google.com/scholar?q=related:RoLis4BUZ0UJ:scholar.google.com/&scioq=intitle:%22technology+management%22+technology+innovation&hl=en&as_sdt=2007&as_ylo=2021&as_yhi=2021"
0,"M Hassan, S Piramuthu","Review of auto-ID technology use in warehouse management",,"International Journal of RF Technologies","content.iospress.com","https://content.iospress.com/articles/international-journal-of-rf-technologies/rft210292","",85,"2021-09-04 12:08:10","","","","",,,,,0,0.00,0,2,,"… Journal of Value Chain Management, Journal of Cases on Information Technology, Management Research Review … more explainability in terms of intra-firm adoption of innovation (Hsu, Kraemer … Based on this perspective, TOE is better to understand technology adoption (Wang …","",""
0,"CV Ferreira, FL Biesek, RK Scalice","… innovation management model based on manufacturing readiness level (MRL), design for manufacturing and assembly (DFMA) and technology readiness level (TRL …",2021,"Journal of the Brazilian Society of …","Springer","https://link.springer.com/article/10.1007/s40430-021-03080-8","",86,"2021-09-04 12:08:10","","10.1007/s40430-021-03080-8","","",,,,,0,0.00,0,3,1,"… 4. Marxt C, Hacklin F, Rothlisberger C, Schaffner T End-to-end innovation: extending the stage-gate model into a sustainable collaboration framework … In: 2010 IEEE international technology management conference, ICE 2010. Institute of Electrical and Electronics Engineers …","https://www.researchgate.net/profile/Cristiano-Ferreira/publication/352691668_Product_innovation_management_model_based_on_manufacturing_readiness_level_MRL_design_for_manufacturing_and_assembly_DFMA_and_technology_readiness_level_TRL/links/60d643f7a6fdccb745e41cd9/Product-innovation-management-model-based-on-manufacturing-readiness-level-MRL-design-for-manufacturing-and-assembly-DFMA-and-technology-readiness-level-TRL.pdf","https://scholar.google.com/scholar?q=related:_6zraYx4SMwJ:scholar.google.com/&scioq=intitle:%22technology+management%22+technology+innovation&hl=en&as_sdt=2007&as_ylo=2021&as_yhi=2021"
0,"RK Jain","EVOLUTION OF MANAGEMENT IN THE INFORMATION TECHNOLOGY DOMAIN TO INCREMENTAL AND TANGIBLE OUTCOME-BASED MODE: ACCELERATED …",2021,"International Journal of Modern Agriculture","modern-journals.com","http://www.modern-journals.com/index.php/ijma/article/view/858","",87,"2021-09-04 12:08:10","","","","",,,,,0,0.00,0,1,1,"… as an enabler for the next phase of The Information Technology management growth, particularly … This also considers the need for innovation and entrepreneurship riding these innovations in … models to iterative models for software projects in the Information Technology domain …","http://www.modern-journals.com/index.php/ijma/article/download/858/751","https://scholar.google.com/scholar?q=related:GmGhq1qVd_wJ:scholar.google.com/&scioq=intitle:%22technology+management%22+technology+innovation&hl=en&as_sdt=2007&as_ylo=2021&as_yhi=2021"
0,"RHH Al-Hashemy","Conceptual framework for the role of information technology in developing a knowledge management system",2021,"… Conference on Information Technology …","ieeexplore.ieee.org","https://ieeexplore.ieee.org/abstract/document/9509928/","",88,"2021-09-04 12:08:10","","","","",,,,,0,0.00,0,1,1,"… Paris: OECD, (1996). [13] A. Mardani, S. Nikoosokhan, Moradi, M., & Doustar, M. ""The Relationship Between Knowledge Management and Innovation Performance"". The Journal of High Technology Management Research, 29(1), 12-26. https://doi …","",""
0,"N Zainal, RZRM Rasi","The Relationship of Logistic Technology in Supply Chain Management on the Customer Relations",2021,"… in Management of Technology and …","publisher.uthm.edu.my","https://publisher.uthm.edu.my/periodicals/index.php/rmtb/article/view/1968","",89,"2021-09-04 12:08:10","","","","",,,,,0,0.00,0,2,1,"… Advances in disruptive technologies, it has gained momentum through the innovation of logistic technologies such as big data and … This research was made possible by support from the Faculty of Technology Management and Business, Universiti Tun Hussein Onn Malaysia …","https://publisher.uthm.edu.my/periodicals/index.php/rmtb/article/download/1968/716","https://scholar.google.com/scholar?q=related:bpTKhPuwAKMJ:scholar.google.com/&scioq=intitle:%22technology+management%22+technology+innovation&hl=en&as_sdt=2007&as_ylo=2021&as_yhi=2021"
0,"AKE Onjewu, A Sukumar, KVD Prakash…","The Triple Helix: A Case Study of Centurion University of Technology and Management",2021,"… the Educational and …","emerald.com","https://www.emerald.com/insight/content/doi/10.1108/S2040-724620210000011013","",90,"2021-09-04 12:08:10","","10.1108/S2040-724620210000011013","","",,,,,0,0.00,0,4,1,"… International Journal of Technology Management and Sustainable Development, 10(1), 27–44. Behera, S., Kim, J., Lee, S., Suh, S., & Park, H. (2012) … Perspectives on Global Development and Technology, 16(4), 434–460 … Phills, J. (2009). Rediscovering social innovation …","","https://scholar.google.com/scholar?q=related:yeywYxv8uMUJ:scholar.google.com/&scioq=intitle:%22technology+management%22+technology+innovation&hl=en&as_sdt=2007&as_ylo=2021&as_yhi=2021"
3,"K Borodako, J Berbeka, M Rudnicki","Technology Used in Knowledge Management by Global Professional Event Services",2021,"Journal of Global Information …","igi-global.com","https://www.igi-global.com/article/technology-used-in-knowledge-management-by-global-professional-event-services/268710","https://scholar.google.com/scholar?cites=13022971124764757742&as_sdt=2005&sciodt=2007&hl=en",91,"2021-09-04 12:08:10","HTML","","","",,,,,3,3.00,1,3,1,"… and/or on the whole economy (Broersma & Van Ark, 2007), and their influence on innovation performance (Audretsch & … knowledge, how companies offering professional business services differ in their approach to knowledge and technology management, what technological …","https://www.igi-global.com/article/technology-used-in-knowledge-management-by-global-professional-event-services/268710","https://scholar.google.com/scholar?q=related:7s7FQz3jurQJ:scholar.google.com/&scioq=intitle:%22technology+management%22+technology+innovation&hl=en&as_sdt=2007&as_ylo=2021&as_yhi=2021"
9,"F Copola Azenha, D Aparecida Reis…","The role and characteristics of hybrid approaches to project management in the development of technology-based products and services",2021,"Project Management …","journals.sagepub.com","https://journals.sagepub.com/doi/abs/10.1177/8756972820956884","https://scholar.google.com/scholar?cites=17825634220955339550&as_sdt=2005&sciodt=2007&hl=en",92,"2021-09-04 12:08:10","","10.1177/8756972820956884","","",,,,,9,9.00,3,3,1,"… specific characteristics of their environments and their projects with the need for greater agility to respond to the demands of innovation … in Brazilian companies and three case studies were conducted in multinationals operating in Brazil that develop technology-based products …","","https://scholar.google.com/scholar?q=related:HgsXNOFfYfcJ:scholar.google.com/&scioq=intitle:%22technology+management%22+technology+innovation&hl=en&as_sdt=2007&as_ylo=2021&as_yhi=2021"
0,"E Carayannis, M Del Giudice, S Tarba…","Building Entrepreneurial Ecosystems: Exploring Ambidexterity in Technology and Engineering Management",2021,"IEEE Transactions …","ieeexplore.ieee.org","https://ieeexplore.ieee.org/abstract/document/9352054/","",93,"2021-09-04 12:08:10","CITATION","","","",,,,,0,0.00,0,4,1,"… However, while there are many studies on the positive effect of ambidexterity on innovation performance studies … engineering processes in en- trepreneurial ecosystems, with specific attention to technology commercialization, technology management, technology acqui- sition …","https://ieeexplore.ieee.org/iel7/17/9352048/09352054.pdf","https://scholar.google.com/scholar?q=related:LlLt5kizoAkJ:scholar.google.com/&scioq=intitle:%22technology+management%22+technology+innovation&hl=en&as_sdt=2007&as_ylo=2021&as_yhi=2021"
1,"A Sivula, A Shamsuzzoha, P Helo","Requirements for Blockchain Technology in Supply Chain Management: An Exploratory Case Study",2021,"","osuva.uwasa.fi","https://osuva.uwasa.fi/handle/10024/11823","https://scholar.google.com/scholar?cites=2519869501863480278&as_sdt=2005&sciodt=2007&hl=en",94,"2021-09-04 12:08:10","","","","",,,,,1,1.00,0,3,1,"… Paper presented at: Technology Management Emerging Technologies (PIC- MET), 2012 Proceedings of PICMET … as a Tenure Track Professor, School of Technology and Innovation, University of … received his PhD in Industrial Management, School of Technology and Innovations …","https://osuva.uwasa.fi/bitstream/handle/10024/11823/Osuva_Sivula_Shamsuzzoha_Helo_2021.pdf?sequence=2&isAllowed=y","https://scholar.google.com/scholar?q=related:1svpCvZf-CIJ:scholar.google.com/&scioq=intitle:%22technology+management%22+technology+innovation&hl=en&as_sdt=2007&as_ylo=2021&as_yhi=2021"
0,"P Kgobe, P Ozor","Integration of Radio Frequency Identification Technology in Supply Chain Management: A Critical Review",2021,"Operations and Supply Chain …","journal.oscm-forum.org","https://journal.oscm-forum.org/publication/article/integration-of-radio-frequency-identification-technology-in-supply-chain-management---a-critical-rev","",95,"2021-09-04 12:08:10","","","","",,,,,0,0.00,0,2,1,"… Today's era of globalisation and rapid technological advancements has resulted in many innovations that have inevitably impacted the traditional way businesses used to operate … Approach, Journal of Technology Management and Innovation, 7(4), pp …","https://journal.oscm-forum.org/journal/journal/download/20210606173959_Paper_3_Vol._14_No_._3,_2021R_.pdf","https://scholar.google.com/scholar?q=related:Y1bswt0L9F8J:scholar.google.com/&scioq=intitle:%22technology+management%22+technology+innovation&hl=en&as_sdt=2007&as_ylo=2021&as_yhi=2021"
0,"M RIZKI, EKAK SAPUTRA","Empowering Human Resources Management in Technology to Improve Leadership Function in Business Practice: Systematic Review",2021,"… of Contemporary Issues in Business and …","cibg.org.au","https://cibg.org.au/index.php/cibg/article/viewFile/4/journal/journal/article_10578.html","",96,"2021-09-04 12:08:10","","","","",,,,,0,0.00,0,2,1,"… 2016). In this way, innovation authority and progress can be started from the exemplary innovations that can be harnessed within the local network … challenges. Journal of Technology Management & Innovation, 3(3), 21–32. 51. Posthuma …","https://cibg.org.au/article_10578_764a90fafd6db7b0a459020b82cdf8c3.pdf","https://scholar.google.com/scholar?q=related:FIHNWTrFWwcJ:scholar.google.com/&scioq=intitle:%22technology+management%22+technology+innovation&hl=en&as_sdt=2007&as_ylo=2021&as_yhi=2021"
